Incident,Player,Position,Team,Fine Category,Games Suspended from,Fined Amount,Reason,Time Title,Date,Year
Igor Olshansky - for hitting Browns quarterback Colt McCoy,Igor Olshansky,Defense,Miami Dolphins,Roughing the Passer,,"$10,000.00",for hitting Browns quarterback Colt McCoy,Week 3,30/09/2011,2011
Yeremiah Bell - for hitting Browns quarterback Colt McCoy,Yeremiah Bell,Safety,Miami Dolphins,Roughing the Passer,,"$15,000.00",for hitting Browns quarterback Colt McCoy,Week 3,30/09/2011,2011
Kenny Phillips - for hitting defenseless Seahawks tight end Zach Miller,Kenny Phillips,Safety,New York Giants,Hit on Defenseless Player,,"$20,000.00",for hitting defenseless Seahawks tight end Zach Miller,Week 5,12/10/2011,2011
Phil Taylor - for hitting Dolphins QB Chad Henne,Phil Taylor,Defense,Cleveland Browns,Roughing the Passer,,"$7,500.00",for hitting Dolphins QB Chad Henne,Week 3,28/09/2011,2011
Patrick Peterson - for hitting Giants kicker Lawrence Tynes on a field-goal attempt,Patrick Peterson,Cornerback,Arizona Cardinals,Late Hit,,"$5,000.00",for hitting Giants kicker Lawrence Tynes on a field-goal attempt,Week 4,07/10/2011,2011
Troy Polamalu - for horse collar tackle against Baltimore,Troy Polamalu,Safety,Pittsburgh Steelers,Horse Collar Tackle,,"$15,000.00",for horse collar tackle against Baltimore,Week 5,16/09/2011,2011
Chad Greenway - for horse collar tackle against Detroit,Chad Greenway,Outside Linebacker,Minnesota Vikings,Horse Collar Tackle,,"$7,500.00",for horse collar tackle against Detroit,Week 3,30/09/2011,2011
Brendon Ayanbadejo - for horse collar tackle against Pittsburgh,Brendon Ayanbadejo,Linebacker,Baltimore Ravens,Horse Collar Tackle,,"$15,000.00",for horse collar tackle against Pittsburgh,Week 1,16/09/2011,2011
Charles Tillman - for horse collar tackle on Lions RB Jahvid Best,Charles Tillman,Cornerback,Chicago Bears,Horse Collar Tackle,,"$7,500.00",for horse collar tackle on Lions RB Jahvid Best,Week 5,14/10/2011,2011
Andre Roberts - for illegal crackback block against Carolina,Andre Roberts,Wide Receiver,Arizona Cardinals,Chop Block,,"$7,500.00",for illegal crackback block against Carolina,Week 1,16/09/2011,2011
Brandon Marshall - for late hit on Browns defensive back Mike Adams,Brandon Marshall,Wide Receiver,Miami Dolphins,Late Hit,,"$7,500.00",for late hit on Browns defensive back Mike Adams,Week 3,30/09/2011,2011
James Farrior - for late hit on Colts quarterback Kerry Collins,James Farrior,Linebacker,Pittsburgh Steelers,Roughing the Passer,,"$15,000.00",for late hit on Colts quarterback Kerry Collins,Week 3,28/09/2011,2011
Nate Burleson - for not showing white in his socks,Nate Burleson,Wide Receiver,Detroit Lions,Other Uniform/Equipment Violation,,"$5,000.00",for not showing white in his socks,Week 5,12/10/2011,2011
Matt Birk - for not wearing a microphone for a recent game against,Matt Birk,Center,Baltimore Ravens,Other Uniform/Equipment Violation,,"$5,000.00",for not wearing a microphone for a recent game against,Week 5,12/10/2011,2011
C.J. Ah You - for roughing Eagles quarterback Michael Vick,C.J. Ah You,Defense,St. Louis Rams,Roughing the Passer,,"$15,000.00",for roughing Eagles quarterback Michael Vick,Week 1,16/09/2011,2011
Haloti Ngata - for roughing Jets quarterback Mark Sanchez,Haloti Ngata,Defensive Tackle,Baltimore Ravens,Roughing the Passer,,"$15,000.00",for roughing Jets quarterback Mark Sanchez,Week 4,07/10/2011,2011
Trent Cole - for roughing Rams quarterback Sam Bradford,Trent Cole,Outside Linebacker,Philadelphia Eagles,Roughing the Passer,,"$15,000.00",for roughing Rams quarterback Sam Bradford,Week 1,16/09/2011,2011
Ahmad Brooks - for roughing Seahawks quarterback Tarvaris Jackson,Ahmad Brooks,Outside Linebacker,San Francisco 49ers,Roughing the Passer,,"$7,500.00",for roughing Seahawks quarterback Tarvaris Jackson,Week 1,16/09/2011,2011
Raheem Brock - for roughing Steelers quarterback Ben Roethlisberger,Raheem Brock,Defensive Tackle,Seattle Seahawks,Roughing the Passer,,"$15,000.00",for roughing Steelers quarterback Ben Roethlisberger,Week 2,23/09/2011,2011
Antrel Rolle - for spearing an opponent with his helmet against Washington,Antrel Rolle,Safety,New York Giants,Helmet Spearing,,"$20,000.00",for spearing an opponent with his helmet against Washington,Week 1,16/09/2011,2011
Perry Riley - for striking a defenseless player on the Rams who was fielding a punt,Perry Riley,Inside Linebacker,Washington Redskins,Hit on Defenseless Player,,"$15,000.00",for striking a defenseless player on the Rams who was fielding a punt,Week 4,07/10/2011,2011
Kenny Phillips - for striking an opponent in the head and neck area,Kenny Phillips,Safety,New York Giants,Striking/Kicking/Kneeing,,"$10,000.00",for striking an opponent in the head and neck area,Week 1,16/09/2011,2011
Travis LaBoy - for striking Chiefs quarterback Matt Cassel in the head,Travis LaBoy,Defensive Tackle,San Diego Chargers,Roughing the Passer,,"$15,000.00",for striking Chiefs quarterback Matt Cassel in the head,Week 3,30/09/2011,2011
Dan Batten - for striking Eagles quarterback Michael Vick in the head and neck area,Dan Batten,Defense,Buffalo Bills,Roughing the Passer,,"$15,000.00",for striking Eagles quarterback Michael Vick in the head and neck area,Week 5,14/10/2011,2011
Patrick Chung - for tackling Dolphins running back Reggie Bush by the back of the helmet,Patrick Chung,Safety,New England Patriots,Horse Collar Tackle,,"$7,500.00",for tackling Dolphins running back Reggie Bush by the back of the helmet,Week 1,16/09/2011,2011
Charles Woodson - for taking a swing at Saints tight end David Thomas,Charles Woodson,Safety,Green Bay Packers,Fighting,,"$10,000.00",for taking a swing at Saints tight end David Thomas,Week 1,16/09/2011,2011
Daniel Graham - for throwing game-winning TD ball into stands,Daniel Graham,Tight End,Tennessee Titans,Football Into Stands,,"$5,000.00",for throwing game-winning TD ball into stands,Week 3,28/09/2011,2011
Danario Alexander - for unnecessary roughness for striking Baltimore place-kicker Billy Cundiff in the leg area trying to block an extra point,Danario Alexander,Wide Receiver,St. Louis Rams,Late Hit,,"$5,000.00",for unnecessary roughness for striking Baltimore place-kicker Billy Cundiff in the leg area trying to block an extra point,Week 3,30/09/2011,2011
Troy Polamalu - for using a cellphone on the sideline,Troy Polamalu,Safety,Pittsburgh Steelers,Other Uniform/Equipment Violation,,"$10,000.00",for using a cellphone on the sideline,Week 6,21/10/2011,2011
Eric Wright - for wearing all black socks (undisclosed amount),Eric Wright,Cornerback,Detroit Lions,Other Uniform/Equipment Violation,,"$5,000.00",for wearing all black socks (undisclosed amount),Week 5,12/10/2011,2011
Brian Orakpo - Helmet to Helmet hit against QB Michael Vick,Brian Orakpo,Outside Linebacker,Washington Redskins,Roughing the Passer,,"$15,000.00",Helmet to Helmet hit against QB Michael Vick,Week 6,21/10/2011,2011
Brandon Meriweather - Helmet to Helmet hit against WR Steve Smith,Brandon Meriweather,Safety,Chicago Bears,Helmet-to-Helmet Hit,,"$20,000.00",Helmet to Helmet hit against WR Steve Smith,Week 4,04/10/2011,2011
Niles Paul - Helmet to Helmet hit on PR Austin Pettis,Niles Paul,Tight End,Washington Redskins,Hit on Defenseless Player,,"$20,000.00",Helmet to Helmet hit on PR Austin Pettis,Week 4,05/10/2011,2011
Eric Weddle - Helmet to Helmet hit on TE Rob Gronkowski,Eric Weddle,Safety,San Diego Chargers,Helmet-to-Helmet Hit,,"$15,000.00",Helmet to Helmet hit on TE Rob Gronkowski,Week 2,23/09/2011,2011
Ray Lewis - Helmet to Helmet hit on WR Hines Ward,Ray Lewis,Linebacker,Baltimore Ravens,Helmet-to-Helmet Hit,,"$20,000.00",Helmet to Helmet hit on WR Hines Ward,Week 9,09/11/2011,2011
Ryan Clark - helmet-to-helmet hit on Ravens' tight end Ed Dickson,Ryan Clark,Safety,Pittsburgh Steelers,Helmet-to-Helmet Hit,,"$40,000.00",helmet-to-helmet hit on Ravens' tight end Ed Dickson,Week 9,10/11/2011,2011
Justin Smith - HIt to the Head against QB Colt McCoy,Justin Smith,Defense,San Francisco 49ers,Roughing the Passer,,"$15,000.00",HIt to the Head against QB Colt McCoy,Week 8,04/11/2011,2011
Von Miller - Hit to the head on QB Carson Palmer,Von Miller,Outside Linebacker,Denver Broncos,Roughing the Passer,,"$15,000.00",Hit to the head on QB Carson Palmer,Week 10,21/11/2011,2011
Aldon Smith - Hitting QB Matthew Stafford below the knee,Aldon Smith,Outside Linebacker,San Francisco 49ers,Roughing the Passer,,"$15,000.00",Hitting QB Matthew Stafford below the knee,Week 6,21/10/2011,2011
Matthew Stafford - Illegal block on CB D.J. Moore,Matthew Stafford,Quarterback,Detroit Lions,Chop Block,,"$7,500.00",Illegal block on CB D.J. Moore,Week 10,18/11/2011,2011
James Harrison - Illegal Hit on Quarterback,James Harrison,Outside Linebacker,Pittsburgh Steelers,Illegal Hit,1,"$73,529.00",Illegal Hit on Quarterback,,13/12/2011,2011
Brian Robison - Kicking G T.J. Lang in the groin,Brian Robison,Defense,Minnesota Vikings,Striking/Kicking/Kneeing,,"$20,000.00",Kicking G T.J. Lang in the groin,Week 7,26/10/2011,2011
Ryan Clark - Late hit on TE Rob Gronkowski,Ryan Clark,Safety,Pittsburgh Steelers,Late Hit,,"$15,000.00",Late hit on TE Rob Gronkowski,Week 8,04/11/2011,2011
Anthony Davis - Leg whipping,Anthony Davis,Right Tackle,San Francisco 49ers,Leg Whip,,"$25,000.00",Leg whipping,Week 4,06/10/2011,2011
Richard Seymour - Multiple Infractions,Richard Seymour,Defensive Tackle,Oakland Raiders,Roughing the Passer,,"$15,000.00",Multiple Infractions,Week 14,11/12/2011,2011
Chris Kemoeatu - Multiple roughing infractions,Chris Kemoeatu,Guard,Pittsburgh Steelers,Late Hit,,"$25,000.00",Multiple roughing infractions,Week 7,27/10/2011,2011
Antonio Garay - or low hit on Patriots quarterback Tom Brady,Antonio Garay,Defense,San Diego Chargers,Low Block,,"$15,000.00",or low hit on Patriots quarterback Tom Brady,Week 2,22/09/2011,2011
Nick Barnett - or unnecessary roughness on Patriots running back Danny Woodhead,Nick Barnett,Inside Linebacker,Buffalo Bills,Late Hit,,"$7,500.00",or unnecessary roughness on Patriots running back Danny Woodhead,Week 3,30/09/2011,2011
Ahmard Hall - PED,Ahmard Hall,Fullback,Tennessee Titans,"Substance Abuse, Performance Enhancing Drugs",4,"$200,000.00",PED,,03/09/2011,2011
Austin Pettis - PED,Austin Pettis,Wide Receiver,St. Louis Rams,"Substance Abuse, Performance Enhancing Drugs",4,"$88,235.00",PED,,21/12/2011,2011
Jimmy Kennedy - PED,Jimmy Kennedy,Defensive Tackle,New York Giants,"Substance Abuse, Performance Enhancing Drugs",4,"$190,588.00",PED,,12/10/2011,2011
Trent Williams - PED,Trent Williams,Left Tackle,Washington Redskins,"Substance Abuse, Performance Enhancing Drugs",4,"$1,847,529.00",PED,,04/12/2011,2011
Vai Taua - PED,Vai Taua,Running Backs,Seattle Seahawks,"Substance Abuse, Performance Enhancing Drugs",4,"$88,235.00",PED,,03/12/2011,2011
Phillip Buchanon - PEDs,Phillip Buchanon,Cornerback,Washington Redskins,"Substance Abuse, Performance Enhancing Drugs",4,"$214,117.00",PEDs,,02/08/2011,2011
Brandon Underwood - Personal Conduct Policy,Brandon Underwood,Cornerback,Green Bay Packers,Personal Conduct,2,"$61,764.00",Personal Conduct Policy,,28/09/2011,2011
Cedric Benson - Personal Conduct Policy,Cedric Benson,Running Backs,Cincinnati Bengals,Personal Conduct,1,"$176,647.00",Personal Conduct Policy,,18/10/2011,2011
Kevin Williams - Roughing QB Jay Cutler,Kevin Williams,Defensive Tackle,Minnesota Vikings,Roughing the Passer,,"$15,000.00",Roughing QB Jay Cutler,Week 6,21/10/2011,2011
D.J. Moore - Roughing QB Matt Stafford,D.J. Moore,Cornerback,Chicago Bears,Helmet-to-Helmet Hit,,"$15,000.00",Roughing QB Matt Stafford,Week 10,18/11/2011,2011
Nick Fairley - Roughing the passer against Bears QB Jay Cutler,Nick Fairley,Defensive Tackle,Detroit Lions,Roughing the Passer,,"$15,000.00",Roughing the passer against Bears QB Jay Cutler,Week 10,18/11/2011,2011
Jason Babin - Roughing the passer against QB Alex Smith,Jason Babin,Defense,Jacksonville Jaguars,Roughing the Passer,,"$15,000.00",Roughing the passer against QB Alex Smith,Week 3,06/10/2011,2011
Ndamukong Suh - Roughing the passer against QB Jake Delhomme,Ndamukong Suh,Defensive Tackle,Detroit Lions,Roughing the Passer,,"$20,000.00",Roughing the passer against QB Jake Delhomme,Preseason,17/08/2011,2011
Bobbie Williams - Substance Abuse,Bobbie Williams,Guard,Cincinnati Bengals,Substance Abuse,4,"$611,764.00",Substance Abuse,,03/09/2011,2011
Charles Grant - Substance Abuse,Charles Grant,Defense,Chicago Bears,Substance Abuse,2,"$264,705.00",Substance Abuse,,03/09/2011,2011
David Reed - Substance Abuse,David Reed,Wide Receiver,Baltimore Ravens,Substance Abuse,1,"$26,470.00",Substance Abuse,,03/09/2011,2011
Jaimie Thomas - Substance Abuse,Jaimie Thomas,Tackle,Indianapolis Colts,Substance Abuse,4,"$115,294.00",Substance Abuse,,05/10/2011,2011
John Moffitt - Substance Abuse,John Moffitt,Guard,Seattle Seahawks,Substance Abuse,4,"$88,325.00",Substance Abuse,,06/12/2011,2011
Kevin Williams - Substance Abuse,Kevin Williams,Defensive Tackle,Minnesota Vikings,Substance Abuse,2,"$1,411,764.00",Substance Abuse,,02/09/2011,2011
Pat Williams - Substance Abuse,Pat Williams,Defensive Tackle,Minnesota Vikings,Substance Abuse,2,$0.00,Substance Abuse,,03/09/2011,2011
Will Smith - Substance Abuse,Will Smith,Outside Linebacker,New Orleans Saints,Substance Abuse,2,"$1,411,764.00",Substance Abuse,,02/09/2011,2011
Brandon Lang - Undisclosed,Brandon Lang,Linebacker,San Diego Chargers,Undisclosed,4,"$75,294.00",Undisclosed,,03/09/2011,2011
Dominic Rhodes - Undisclosed,Dominic Rhodes,Running Backs,Indianapolis Colts,Undisclosed,1,"$11,764.00",Undisclosed,,03/09/2011,2011
Eric Alexander - Undisclosed,Eric Alexander,Linebacker,Cleveland Browns,Undisclosed,4,"$150,588.00",Undisclosed,,03/09/2011,2011
Eric Barton - Undisclosed,Eric Barton,Linebacker,Cleveland Browns,Undisclosed,4,$0.00,Undisclosed,,03/09/2011,2011
Robert Brewster - Undisclosed,Robert Brewster,Tackle,Dallas Cowboys,Undisclosed,4,"$112,941.00",Undisclosed,,03/09/2011,2011
Terrelle Pryor - Undisclosed,Terrelle Pryor,Quarterback,Oakland Raiders,Undisclosed,5,"$110,294.00",Undisclosed,,22/08/2011,2011
Ndamukong Suh - Unsportsmanlike Conduct,Ndamukong Suh,Defensive Tackle,Detroit Lions,Unsportsmanlike Conduct,2,"$165,294.00",Unsportsmanlike Conduct,,29/11/2011,2011
Fred Davis - Violating the NFL's substance abuse policy (1),Fred Davis,Tight End,Washington Redskins,Substance Abuse,4,"$141,176.00",Violating the NFL's substance abuse policy,,04/12/2011,2011
Brandon Deaderick - VIolation of Team Policy,Brandon Deaderick,Defensive Tackle,New England Patriots,VIolation of Team Policy,1,"$26,470.00",VIolation of Team Policy,,03/01/2011,2011
Wes Welker - Wearing unauthorized hat to press conference,Wes Welker,Wide Receiver,New England Patriots,Other Uniform/Equipment Violation,,"$10,000.00",Wearing unauthorized hat to press conference,Week 17,31/12/2011,2011
Jonathan Vilma - conduct detrimental to league,Jonathan Vilma,Inside Linebacker,New Orleans Saints,Detrimental Conduct,12,"$1,600,000.00",conduct detrimental to league,,09/10/2012,2012
Will Smith - conduct detrimental to league,Will Smith,Outside Linebacker,New Orleans Saints,Detrimental Conduct,4,"$1,619,377.00",conduct detrimental to league,,09/10/2012,2012
Brandon Jacobs - conduct detrimental to team,Brandon Jacobs,Running Backs,San Francisco 49ers,Detrimental Conduct,3,"$168,000.00",conduct detrimental to team,,10/12/2012,2012
Rashard Mendenhall - conduct detrimental to the team,Rashard Mendenhall,Running Backs,Pittsburgh Steelers,Detrimental Conduct,1,"$36,029.00",conduct detrimental to the team,,11/12/2012,2012
D.J. Williams - DUI,D.J. Williams,Inside Linebacker,Denver Broncos,Driving Under Influence,6,"$1,729,411.00",DUI,,15/08/2012,2012
Golden Tate - for a blindside block on Cowboys linebacker Sean Lee,Golden Tate,Wide Receiver,Seattle Seahawks,Blindside Block,,"$21,000.00",for a blindside block on Cowboys linebacker Sean Lee,Week 2,21/09/2012,2012
Gosder Cherilus - for a chop block against Green Bay,Gosder Cherilus,Right Tackle,Detroit Lions,Chop Block,,"$10,000.00",for a chop block against Green Bay,Week 14,14/12/2012,2012
Michael Oher - for a chop block against New York Giants,Michael Oher,Right Tackle,Baltimore Ravens,Chop Block,,"$10,000.00",for a chop block against New York Giants,Week 16,28/12/2012,2012
Sen'Derrick Marks - for a face mask penalty against Green Bay,Sen'Derrick Marks,Defensive Tackle,Tennessee Titans,Face Mask,,"$7,875.00",for a face mask penalty against Green Bay,Week 16,28/12/2012,2012
Jasper Brinkley - for a facemask penalty against Green Bay,Jasper Brinkley,Inside Linebacker,Minnesota Vikings,Face Mask,,"$7,875.00",for a facemask penalty against Green Bay,Week 13,07/12/2012,2012
Quinton Coples - for a facemask penalty on Jaguars QB Chad Henne,Quinton Coples,Outside Linebacker,New York Jets,Face Mask,,"$15,000.00",for a facemask penalty on Jaguars QB Chad Henne,Week 14,14/12/2012,2012
Robert Quinn - for a helmet-to-helmet hit on Cardinals quarterback Kevin Kolb,Robert Quinn,Defense,St. Louis Rams,Helmet-to-Helmet Hit,,"$15,750.00",for a helmet-to-helmet hit on Cardinals quarterback Kevin Kolb,Week 5,12/10/2012,2012
Jerron McMillian - for a helmet-to-helmet hit on Giants TE Martellus Bennett,Jerron McMillian,Safety,Green Bay Packers,Helmet-to-Helmet Hit,,"$21,000.00",for a helmet-to-helmet hit on Giants TE Martellus Bennett,Week 12,30/11/2012,2012
Mason Foster - for a helmet-to-helmet hit on Giants wide receiver Domenik Hixon,Mason Foster,Inside Linebacker,Tampa Bay Buccaneers,Helmet-to-Helmet Hit,,"$21,000.00",for a helmet-to-helmet hit on Giants wide receiver Domenik Hixon,Week 2,21/09/2012,2012
Jason Jones - for a helmet-to-helmet hit on Patriots quarterback Tom Brady,Jason Jones,Defense,Seattle Seahawks,Helmet-to-Helmet Hit,,"$15,750.00",for a helmet-to-helmet hit on Patriots quarterback Tom Brady,Week 6,19/10/2012,2012
Dashon Goldson - for a helmet-to-helmet hit on Patriots TE Aaron Hernandez,Dashon Goldson,Safety,San Francisco 49ers,Helmet-to-Helmet Hit,,"$21,000.00",for a helmet-to-helmet hit on Patriots TE Aaron Hernandez,Week 15,20/12/2012,2012
Ed Reed - for a helmet-to-helmet hit on Patriots WR Deion Branch.,Ed Reed,Safety,Baltimore Ravens,Helmet-to-Helmet Hit,,"$21,000.00",for a helmet-to-helmet hit on Patriots WR Deion Branch.,Week 3,28/09/2012,2012
Garrett McIntyre - for a helmet-to-helmet hit on Rams QB Sam Bradford,Garrett McIntyre,Outside Linebacker,New York Jets,Helmet-to-Helmet Hit,,"$15,750.00",for a helmet-to-helmet hit on Rams QB Sam Bradford,Week 11,23/11/2012,2012
Ed Reed - for a helmet-to-helmet hit on Steelers WR Emmanuel Sanders,Ed Reed,Safety,Baltimore Ravens,Helmet-to-Helmet Hit,,"$50,000.00",for a helmet-to-helmet hit on Steelers WR Emmanuel Sanders,Week 11,21/11/2012,2012
Kareem Jackson - for a high hit on Vikings WR Jarius Wright,Kareem Jackson,Cornerback,Houston Texans,Hit on Defenseless Player,,"$21,000.00",for a high hit on Vikings WR Jarius Wright,Week 17,28/12/2012,2012
Brandon Harris - for a hit on a Lions defenseless receiver on a punt return,Brandon Harris,Cornerback,Houston Texans,Hit on Defenseless Player,,"$21,000.00",for a hit on a Lions defenseless receiver on a punt return,Week 12,30/11/2012,2012
Ed Reed - for a hit on Giants receiver Victor Cruz,Ed Reed,Safety,Baltimore Ravens,Hit on Defenseless Player,,"$55,000.00",for a hit on Giants receiver Victor Cruz,Week 16,27/12/2012,2012
Lawrence Timmons - for a hit on Jets quarterback Mark Sanchez,Lawrence Timmons,Inside Linebacker,Pittsburgh Steelers,Roughing the Passer,,"$21,000.00",for a hit on Jets quarterback Mark Sanchez,Week 2,21/09/2012,2012
Navorro Bowman - for a hit on Rams RB Steven Jackson,Navorro Bowman,Inside Linebacker,San Francisco 49ers,Late Hit,,"$10,000.00",for a hit on Rams RB Steven Jackson,Week 14,07/12/2012,2012
Dejon Gomes - for a hit to head of Saints running back Darren Sproles,Dejon Gomes,Safety,Washington Redskins,Hit on Defenseless Player,,"$8,000.00",for a hit to head of Saints running back Darren Sproles,Week 1,14/09/2012,2012
Chris Long - for a hit to the head of Cardinals QB Ryan Lindley,Chris Long,Defense,St. Louis Rams,Hit on Defenseless Player,,"$15,750.00",for a hit to the head of Cardinals QB Ryan Lindley,Week 12,30/11/2012,2012
Earl Thomas - for a hit to the head of Dolphins QB Ryan Tannehill,Earl Thomas,Safety,Seattle Seahawks,Hit on Defenseless Player,,"$15,750.00",for a hit to the head of Dolphins QB Ryan Tannehill,Week 12,30/11/2012,2012
Marcus Dowtin - for a hit to the head of Dolphins quarterback Matt Moore,Marcus Dowtin,Outside Linebacker,New York Jets,Hit on Defenseless Player,,"$15,750.00",for a hit to the head of Dolphins quarterback Matt Moore,Week 8,02/11/2012,2012
Christopher Conte - for a hit to the head of Panthers wide receiver Brandon LaFell,Christopher Conte,Safety,Chicago Bears,Hit on Defenseless Player,,"$21,000.00",for a hit to the head of Panthers wide receiver Brandon LaFell,Week 8,02/11/2012,2012
Robert Quinn - for a hit to the head on Redskins left tackle Trent Williams,Robert Quinn,Defense,St. Louis Rams,Hit on Defenseless Player,,"$7,857.00",for a hit to the head on Redskins left tackle Trent Williams,Week 2,21/09/2012,2012
DeAngelo Hall - for a horse collar tackle against Dallas,DeAngelo Hall,Cornerback,Washington Redskins,Horse Collar Tackle,,"$20,000.00",for a horse collar tackle against Dallas,Week 12,30/11/2012,2012
Tyron Smith - for a horse collar tackle against New York Giants,Tyron Smith,Left Tackle,Dallas Cowboys,Horse Collar Tackle,,"$15,750.00",for a horse collar tackle against New York Giants,Week 1,14/09/2012,2012
LaRon Landry - for a horse collar tackle against Pittsburgh,LaRon Landry,Safety,New York Jets,Horse Collar Tackle,,"$15,750.00",for a horse collar tackle against Pittsburgh,Week 2,21/09/2012,2012
Brian Urlacher - for a horse collar tackle against Seattle,Brian Urlacher,Linebacker,Chicago Bears,Horse Collar Tackle,,"$21,000.00",for a horse collar tackle against Seattle,Week 13,07/12/2012,2012
Tyvon Branch - for a horse collar tackle against Tampa Bay,Tyvon Branch,Safety,Oakland Raiders,Horse Collar Tackle,,"$15,750.00",for a horse collar tackle against Tampa Bay,Week 9,09/11/2012,2012
Michael Griffin - for a horse collar tackle of Bears RB Matt Forte,Michael Griffin,Safety,Tennessee Titans,Horse Collar Tackle,,"$20,000.00",for a horse collar tackle of Bears RB Matt Forte,Week 9,09/11/2012,2012
Prince Amukamara - for a horse collar tackle of Saints RB Pierre Thomas,Prince Amukamara,Cornerback,New York Giants,Horse Collar Tackle,,"$15,750.00",for a horse collar tackle of Saints RB Pierre Thomas,Week 14,14/12/2012,2012
Alphonso Smith - for a horse collar tackle on Bears wide receiver Brandon Marshall.,Alphonso Smith,Cornerback,Detroit Lions,Horse Collar Tackle,,"$15,750.00",for a horse collar tackle on Bears wide receiver Brandon Marshall.,Week 7,26/10/2012,2012
Jason Babin - for a horse collar tackle on Cardinals running back LaRod Stephens-Howling,Jason Babin,Defense,Philadelphia Eagles,Horse Collar Tackle,,"$15,750.00",for a horse collar tackle on Cardinals running back LaRod Stephens-Howling,Week 3,28/09/2012,2012
Nick Fairley - for a horse collar tackle on Colts QB Andrew Luck,Nick Fairley,Defensive Tackle,Detroit Lions,Horse Collar Tackle,,"$15,750.00",for a horse collar tackle on Colts QB Andrew Luck,Week 13,07/12/2012,2012
Kevin Vickerson - for a horse collar tackle on Panthers QB Cam Newton,Kevin Vickerson,Defensive Tackle,Denver Broncos,Horse Collar Tackle,,"$15,000.00",for a horse collar tackle on Panthers QB Cam Newton,Week 10,15/11/2012,2012
Harrison Smith - for a horse collar tackle on Redskins quarterback Robert Griffin III,Harrison Smith,Safety,Minnesota Vikings,Horse Collar Tackle,,"$15,750.00",for a horse collar tackle on Redskins quarterback Robert Griffin III,Week 6,19/10/2012,2012
Brian Urlacher - for a horse collar tackle on Vikings RB Adrian Peterson,Brian Urlacher,Linebacker,Chicago Bears,Horse Collar Tackle,,"$15,750.00",for a horse collar tackle on Vikings RB Adrian Peterson,Week 12,30/11/2012,2012
Ted Larsen - for a late hit against Carolina,Ted Larsen,Guard,Tampa Bay Buccaneers,Late Hit,,"$7,875.00",for a late hit against Carolina,Week 11,23/11/2012,2012
DeAngelo Hall - for a late hit against Dallas,DeAngelo Hall,Cornerback,Washington Redskins,Late Hit,,"$15,750.00",for a late hit against Dallas,Week 12,30/11/2012,2012
Dawan Landry - for a late hit against Indianapolis,Dawan Landry,Safety,Jacksonville Jaguars,Late Hit,,"$10,000.00",for a late hit against Indianapolis,Week 10,16/11/2012,2012
Terrance Knighton - for a late hit against Indianapolis,Terrance Knighton,Defensive Tackle,Jacksonville Jaguars,Late Hit,,"$25,000.00",for a late hit against Indianapolis,Week 10,16/11/2012,2012
Jerry Hughes - for a late hit against Jacksonville,Jerry Hughes,Defense,Indianapolis Colts,Late Hit,,"$21,000.00",for a late hit against Jacksonville,Week 10,16/11/2012,2012
Charles Tillman - for a late hit against Minnesota,Charles Tillman,Cornerback,Chicago Bears,Late Hit,,"$7,875.00",for a late hit against Minnesota,Week 14,14/12/2012,2012
Anquan Boldin - for a late hit against San Diego,Anquan Boldin,Wide Receiver,Baltimore Ravens,Late Hit,,"$7,875.00",for a late hit against San Diego,Week 12,30/11/2012,2012
Richie Incognito - for a late hit against Tennessee,Richie Incognito,Guard,Miami Dolphins,Late Hit,,"$10,000.00",for a late hit against Tennessee,Week 10,16/11/2012,2012
Anquan Boldin - for a late hit against Washington,Anquan Boldin,Wide Receiver,Baltimore Ravens,Late Hit,,"$15,750.00",for a late hit against Washington,Week 15,21/12/2012,2012
Jerod Mayo - for a late hit on a run out of bounds by Bills RB C.J. Spiller,Jerod Mayo,Inside Linebacker,New England Patriots,Late Hit,,"$10,000.00",for a late hit on a run out of bounds by Bills RB C.J. Spiller,Week 10,16/11/2012,2012
