Video Game,Profile,Descritpion,Release Year,Users' Review (stars),Image,Genre,Theme,Platform Manufacturer(s),Platform(s),Developers
Silver,http://www.giantbomb.com/silver/3030-7749/,"Step into the shoes of the young hero David to rescue the abducted women of Jarrah, including David's wife, Jennifer, from the evil fangs of the malicious sorcerer known as Silver.",1999,3,http://static.giantbomb.com/uploads/scale_small/0/9778/2206322-sega_dreamcast_silver.jpg,"Action, Role-Playing",Fantasy,"Apple, Sega, PC","Mac, Dreamcast, PC",Spiral House
Skate or Die: Bad 'N Rad,http://www.giantbomb.com/skate-or-die-bad-n-rad/3030-5589/,A skateboarding game released for the original Game Boy that featured side-scrolling/top-down platforming action.,1990,,http://static.giantbomb.com/uploads/scale_small/10/103881/2181146-cover.jpg,"Action, Skateboarding, Platformer",,Nintendo,Game Boy,Konami
Smart Ball,http://www.giantbomb.com/smart-ball/3030-21634/,A simple SNES platform game in which the player has been transformed into a blue ball and must embark on a journey to stop an evil witch.,1991,,http://static.giantbomb.com/uploads/scale_small/0/8113/216004-smart_ball.jpg,Platformer,Fantasy,Nintendo,Super Nintendo Entertainment System,"Game Freak, System Sacom"
Smurf: Rescue in Gargamel's Castle,http://www.giantbomb.com/smurf-rescue-in-gargamels-castle/3030-19373/,Smurf: Rescue in Gargamel's castle puts eveyone's favorite Belgium woodland creature in a daring adventure where he must jump over fences in search of Smurfette.,1982,,http://static.giantbomb.com/uploads/scale_small/0/40/11888-smurfs.jpg,Action,,"Atari, Coleco Industries","Atari 2600, ColecoVision",Coleco
Sonic Blast Man,http://www.giantbomb.com/sonic-blast-man/3030-2840/,A superhero brawler franchise developed by Taito for the Arcades before moving to the SNES.,1992,,http://static.giantbomb.com/uploads/scale_small/9/93770/2364763-snes_sonicblastman.jpg,"Action, Brawler",Superhero,"Nintendo, Arcade","Super Nintendo Entertainment System, Arcade","Taito Corporation, ITL"
Sonic CD,http://www.giantbomb.com/sonic-cd/3030-14433/,"Sonic the Hedgehog's sole adventure for the Sega CD, as he travels through time to save the fate of Little Planet from Dr. Robotnik's army of robots (including Sonic's new adversary: his metallic doppelganger).",1993,4.33,http://static.giantbomb.com/uploads/scale_small/0/1486/2078290-soniccd_brighterandcleaner.png,"Action, Platformer","Fantasy, Sci-Fi, Anime, Post-Apocalyptic","Sega, Microsoft, Sony, PC, Apple, Android, Ouya","Sega CD, Xbox 360 Games Store, PlayStation Network (PS3), PC, iPhone, iPad, Android, Windows Phone, Ouya","Sonic Team, BlitWorks"
Space Ace,http://www.giantbomb.com/space-ace/3030-463/,"A Laserdisc-based animated reaction game. Space Ace must save his girlfriend, Kimberly from the evil alien, Borf in this follow up to Dragon's Lair.",1984,,http://static.giantbomb.com/uploads/scale_small/11/117445/1654787-space_ace_.jpg,Adventure,,"Commodore, 3DO, Phillips, Atari, Sega, Arcade, Sony, PC, Apple, Nintendo, RDI Video Systems","Amiga, Super Nintendo Entertainment System, Atari ST, Commodore 64, 3DO, CD-i, Jaguar, Sega CD, Wii, Arcade, PlayStation Network (PS3), PC, iPhone, DSiWare, RDI Halcyon","Probe Entertainment, RDI Video Systems"
Sparkster,http://www.giantbomb.com/sparkster/3030-19920/,Sort of a spin-off game to the Genesis game known as Rocket Knight Adventures. A Genesis game was released at the same time but was a more direct sequel.,1994,,http://static.giantbomb.com/uploads/scale_small/9/93770/2364768-snes_sparkster_2.jpg,"Action, Platformer",Fantasy,Nintendo,Super Nintendo Entertainment System,Konami
Spelunky,http://www.giantbomb.com/spelunky/3030-24999/,"As a brave, but fragile adventurer, explore dangerous procedurally-generated caves to collect treasure and gain better equipment, before dying horribly and starting all over again.",2009,4.73,http://static.giantbomb.com/uploads/scale_small/9/93770/2288493-spelunky.png,"Puzzle, Platformer, Action, Adventure","Sci-Fi, Mayan","Microsoft, Sony, PC","Xbox 360 Games Store, PlayStation Network (PS3), PC, PlayStation Network (Vita), PlayStation 4","Mossmouth, BlitWorks"
Spider-Man: The Movie,http://www.giantbomb.com/spider-man-the-movie/3030-8322/,A game based on Marvel's superhero and on the first movie of the Spider-Man franchise. It also featured many villains that did not appear in the movie.,2002,,http://static.giantbomb.com/uploads/scale_small/8/87790/2280510-box_sman.png,"Action, Adventure","Crime, Superhero","Sony, Microsoft, Nintendo, PC","Game Boy Advance, PlayStation 2, GameCube, Xbox, PC","Digital Eclipse Software, Treyarch, Westlake Interactive"
Spinmaster,http://www.giantbomb.com/spinmaster/3030-10031/,,1994,,http://static.giantbomb.com/uploads/scale_small/1/17172/1083066-spin_001.jpg,"Action, Platformer",Fantasy,"SNK, Arcade, Nintendo, Zeebo","Neo Geo, Arcade, Wii Shop, Zeebo",Data East
Splatterhouse,http://www.giantbomb.com/splatterhouse/3030-22968/,"Splatterhouse revisits Rick Taylor as he tries to rescue his girlfriend Jennifer from the evil clutches of Dr. West. In the process, he must battle against evil beings known as the ""Corrupted"" in bloody and brutal combat.",2010,3.08,http://static.giantbomb.com/uploads/scale_small/8/87790/1886626-box_shouse.png,"Action, Brawler","Horror, Sci-Fi, Comedy","Microsoft, Sony","Xbox 360, PlayStation 3","Bandai Namco Games, Bottlerocket Entertainment"
Sqrxz III,http://www.giantbomb.com/sqrxz-iii/3030-44490/,Sqrxz must rescue his girlfriend from the forces of evil in this third outing from Retroguru.,2011,,http://static.giantbomb.com/uploads/scale_small/16/164924/2570119-5033957890-sqrxz.png,Platformer,,"Commodore, Apple, Sega, PC, GamePark, Linux","Amiga, Mac, Dreamcast, PC, GamePark 32, Linux",Retroguru
Star Fox Adventures,http://www.giantbomb.com/star-fox-adventures/3030-19026/,"Rare's last game for a major Nintendo console, Star Fox Adventures is a spin-off action-adventure game (in the Star Fox series of shooters) starring Fox McCloud, who must find a way to save the aptly-named Dinosaur Planet from destruction.",2002,3.44,http://static.giantbomb.com/uploads/scale_small/8/87790/1806119-box_sfoxa.png,"Action, Adventure, Shooter, Flight Simulator","Fantasy, Sci-Fi",Nintendo,GameCube,Rare
Super Ghouls 'N Ghosts,http://www.giantbomb.com/super-ghouls-n-ghosts/3030-7450/,"Sequel to the classic action-platformer Ghouls 'N Ghosts, once again sending Arthur on a brutally difficult quest.",1991,4,http://static.giantbomb.com/uploads/scale_small/9/93770/2364818-snes_superghoulsnghosts.jpg,"Action, Platformer","Horror, Fantasy, Sci-Fi","Sony, Sega, Nintendo","Game Boy Advance, Super Nintendo Entertainment System, PlayStation, Saturn, Wii Shop",Capcom
Super Mario 64 DS,http://www.giantbomb.com/super-mario-64-ds/3030-8942/,"A remake of the original Nintendo 64 classic, Super Mario 64 DS adds 30 new stars, three new playable characters and 36 mini-games utilizing the touch screen.",2004,3.86,http://static.giantbomb.com/uploads/scale_small/8/87790/1839039-box_sm64ds.png,"Minigame Collection, Platformer, Action, Adventure",Fantasy,Nintendo,Nintendo DS,Nintendo
Super Mario Bros.,http://www.giantbomb.com/super-mario-bros/3030-15544/,"Focusing on a humble plumber and his brother setting out to rescue a Princess who has been kidnapped by a vile lizard king, Super Mario Bros. is a platformer created by Shigeru Miyamoto, published by Nintendo, and is one of the best selling video games of all time.",1985,4.73,http://static.giantbomb.com/uploads/scale_small/9/93770/2362267-nes_supermariobros.jpg,Platformer,Fantasy,Nintendo,"Game Boy Advance, Nintendo Entertainment System, Wii Shop, Famicom Disk System, Nintendo 3DS eShop, Wii U","Nintendo, SRD"
Super Mario Bros. 3: Super Mario Advance 4,http://www.giantbomb.com/super-mario-bros-3-super-mario-advance-4/3030-20748/,Super Mario Advance 4 is the Game Boy Advance remake of Super Mario Bros. 3 on the NES.,2003,5,http://static.giantbomb.com/uploads/scale_small/0/775/215281-589393_24375_front.jpg,"Adventure, Platformer",Fantasy,Nintendo,Game Boy Advance,Nintendo
Super Mario Land,http://www.giantbomb.com/super-mario-land/3030-19834/,Princess Daisy of Sarasaland has been kidnapped by the evil alien Tatanga and it's up to Mario to rescue her in this handheld platformer (and launch title) for the original Game Boy.,1989,3.6,http://static.giantbomb.com/uploads/scale_small/8/87790/2269418-box_sml.png,"Platformer, Shoot 'Em Up","Fantasy, Egyptian",Nintendo,"Game Boy, Nintendo 3DS eShop",Nintendo
Super Mario RPG: Legend of the Seven Stars,http://www.giantbomb.com/super-mario-rpg-legend-of-the-seven-stars/3030-7358/,Join Mario in his first RPG adventure! Explore new and previously unseen areas of the Mushroom Kingdom on a quest to stop the mechanical Smithy on a path of conquest in this collaboration between Square and Nintendo.,1996,4.91,http://static.giantbomb.com/uploads/scale_small/9/93770/2364832-snes_supermariorpg_2.jpg,"Adventure, Role-Playing",Fantasy,Nintendo,"Super Nintendo Entertainment System, Wii Shop","Squaresoft, Square Enix"
Super Mario Sunshine,http://www.giantbomb.com/super-mario-sunshine/3030-6649/,"Peach, as usual...",2002,4.14,http://static.giantbomb.com/uploads/scale_small/8/82063/2609772-smsclean.jpg,"Platformer, Action, Adventure",Fantasy,Nintendo,GameCube,Nintendo
Super Meat Boy,http://www.giantbomb.com/super-meat-boy/3030-25114/,"When his beloved Bandage Girl is kidnapped by the evil Dr. Fetus, the diminutive yet plucky Meat Boy springs into action!",2010,4.61,http://static.giantbomb.com/uploads/scale_small/8/87790/1633133-box_supermeatboy.png,Platformer,Comedy,"Apple, Microsoft, PC, Linux","Mac, Xbox 360, PC, Linux",Team Meat
Super Smash Bros. Brawl,http://www.giantbomb.com/super-smash-bros-brawl/3030-20588/,"Strap on your fighting shoes and get ready to brawl in the first Smash Bros. game for the Wii. Super Smash Bros. Brawl is one of the best-selling Wii games, selling over 4.85 million units worldwide.",2008,4.59,http://static.giantbomb.com/uploads/scale_small/8/82063/2561025-ssb.jpg,"Action, Fighting, Brawler",Fantasy,Nintendo,Wii,"Sora, Game Arts, Toylogic, Paon Corporation, Monolith"
Superfrog,http://www.giantbomb.com/superfrog/3030-12022/,"Superfrog is a high production value, side scrolling platformer with elements taken from many other games from the same genre including Mario and Sonic the Hedgehog.",1993,,http://static.giantbomb.com/uploads/scale_small/17/174044/2605182-superfrogboxart.jpg,"Action, Platformer, Shoot 'Em Up, Gambling","Fantasy, Egyptian","Commodore, PC","Amiga, Amiga CD32, PC",Team17 Software
Syberia,http://www.giantbomb.com/syberia/3030-16965/,"Kate Walker, a successful lawyer, travels to find Hans, the sole heir to a factory and eventually ends up on a journey to find him and the once thought to be extinct Mammoths.",2002,,http://static.giantbomb.com/uploads/scale_small/1/15035/639770-syberiaboxart.jpg,Adventure,Steampunk,"Microsoft, Nintendo, Sony, PC, Android","PlayStation 2, Xbox, Nintendo DS, PlayStation Network (PS3), PC, Android",Microids
Takahashi Meijin no Bouken Jima IV,http://www.giantbomb.com/takahashi-meijin-no-bouken-jima-iv/3030-22925/,Last Adventure Island game for NES.,1994,,http://static.giantbomb.com/uploads/scale_small/1/12388/476113-adventureisland4.jpg,"Action, Platformer",,Nintendo,Nintendo Entertainment System,Hudson Entertainment
Tales of Legendia,http://www.giantbomb.com/tales-of-legendia/3030-5315/,"Tales of Legendia is the second full 3D game of the Tales Series. It follows Senel Coolidge and his sister Shirley, who get into a shipwreck and get stuck on a huge boat called the Legacy. Throughout the game you meet several different characters that will join your party.",2006,2.5,http://static.giantbomb.com/uploads/scale_small/8/87790/1837513-box_tol.png,"Action, Role-Playing","Fantasy, Anime",Sony,PlayStation 2,"Project Soul, Dagmusic, 8-4, Namco"
Tales of Monkey Island Chapter 1: Launch of the Screaming Narwhal,http://www.giantbomb.com/tales-of-monkey-island-chapter-1-launch-of-the-scr/3030-26776/,"Telltale resurrects the much-loved pirate adventure franchise with Tales of Monkey Island, a five-part episodic series continuing the adventures of Guybrush Threepwood, this being the first.",2009,4,http://static.giantbomb.com/uploads/scale_small/0/4938/1076091-1.png,Adventure,Comedy,"Apple, Nintendo, Sony, PC","Mac, Wii Shop, PlayStation Network (PS3), PC, iPhone, iPad",Telltale Games
Tales of Rebirth,http://www.giantbomb.com/tales-of-rebirth/3030-11703/,"Tales of Rebirth is the sixth main entry of Namco's Tales series of video games. Tales of Rebirth is set in a world where humans (called Humas) and Gajumas (beast people) coexist in relative peace.Rebirth breaks slightly from the series with a new take on the Linear Motion Battle System, the so-called ""Three-Line Linear Motion"" system. The player's characters and enemies are placed on three different planes and the player has the ability to switch between these planes during battle.",2004,,http://static.giantbomb.com/uploads/scale_small/0/112/178668-front.jpg,"Action, Adventure, Role-Playing",,Sony,"PlayStation Portable, PlayStation 2","Namco, Namco"
Tales of Symphonia,http://www.giantbomb.com/tales-of-symphonia/3030-21237/,Tales of Symphonia is a cel-shaded action RPG and is another game in Namco's Tales series. It expands upon the series' battle system and emphasizes on relationships with other characters by the decisions you make throughout the game.,2004,4.71,http://static.giantbomb.com/uploads/scale_small/8/87790/1837515-box_tos.png,"Action, Role-Playing","Fantasy, Anime","Sony, Nintendo","PlayStation 2, GameCube, PlayStation 3","Namco, Namco"
Tales of the Abyss,http://www.giantbomb.com/tales-of-the-abyss/3030-14210/,Tales of the Abyss is the eighth main game in the Tales series.,2005,4,http://static.giantbomb.com/uploads/scale_small/8/87790/1837485-bot_tota.png,"Action, Role-Playing","Fantasy, Anime","Sony, Nintendo","PlayStation 2, Nintendo 3DS, Nintendo 3DS eShop","Namco, 8-4, DIGITAL Hearts Co."
Tales of Vesperia,http://www.giantbomb.com/tales-of-vesperia/3030-20836/,"Tales of Vesperia is a Japanese Role-Playing Game and the first entry in the long-running ""Tales of"" franchise on seventh-generation consoles.",2008,4.53,http://static.giantbomb.com/uploads/scale_small/8/87790/1837518-box_tov.png,"Role-Playing, Action, Adventure","Fantasy, Anime","Microsoft, Sony","Xbox 360, PlayStation 3, Xbox 360 Games Store","Namco, 8-4"
Tenchu: Shadow Assassins,http://www.giantbomb.com/tenchu-shadow-assassins/3030-24617/,"The first Tenchu game to arrive on the Nintendo Wii, Tenchu: Shadow Assassins is the fourth game in the main series. Players once again reprise the roles of Rikimaru and Ayame in this stealth ninja action game.",2008,2,http://static.giantbomb.com/uploads/scale_small/3/34651/1811078-tenchu4psp.jpg,"Action, Adventure","Espionage, Martial Arts","Sony, Nintendo","PlayStation Portable, Wii","Acquire, 8-4"
The Adventures of Bayou Billy,http://www.giantbomb.com/the-adventures-of-bayou-billy/3030-12536/,"The Adventures of Bayou Billy is an action game released for the NES by Konami. The game is primarily a side-scrolling beat-em-up, but it also includes driving and shooting segments.",1988,,http://static.giantbomb.com/uploads/scale_small/9/93770/2361120-nes_adventuresofbayoubilly.jpg,"Action, Driving/Racing, Shooter, Brawler, Platformer",,Nintendo,Nintendo Entertainment System,Konami
The Black Cauldron,http://www.giantbomb.com/the-black-cauldron/3030-16268/,"Based on the novel and movie, The Black Cauldron was a graphical adventure game developed by veteran game designer Al Lowe and published by Sierra Entertainment. The game was notable for utilizing function keys instead of the common text parser system.",1986,,http://static.giantbomb.com/uploads/scale_small/0/1987/629342-black_cauldron__the___front.jpg,Adventure,Fantasy,"Commodore, Atari, Apple, PC","Amiga, Apple II, Atari ST, Apple IIgs, PC",Sierra
The Bouncer,http://www.giantbomb.com/the-bouncer/3030-11814/,"Squaresoft's first PS2 release, The Bouncer is a beat'em up that features RPG mechanics and a branching story path. It tells the tale of three bouncers that fight to rescue a girl from the clutches of a megalomaniacal CEO. The game was known for its production values, introducing a juggling physics engine and graphical techniques such as bloom lighting and depth-of-field effects.",2000,3.33,http://static.giantbomb.com/uploads/scale_small/8/87790/2116198-box_bouncer.png,"Action, Role-Playing, Brawler","Sci-Fi, Anime, Martial Arts",Sony,PlayStation 2,"Dream Factory, Squaresoft, Square EA, Square Visual Works"
The Darkness,http://www.giantbomb.com/the-darkness/3030-9201/,"On his 21st birthday, Jackie Estacado gets possessed by an entity known as The Darkness. After getting into trouble with the Mafia, Jackie finds himself on the run, trying to protect the people most important to him.",2007,3.75,http://static.giantbomb.com/uploads/scale_small/8/87790/1778769-box_darkness.png,"Action, Shooter","Horror, Fantasy","Microsoft, Sony","Xbox 360, PlayStation 3",Starbreeze Studios
The Denpa Men: They Came By Wave,http://www.giantbomb.com/the-denpa-men-they-came-by-wave/3030-39862/,"A dungeon crawler with nods to Pikmin, Dragon Quest and Pokemon. Use the 3DS camera to capture Denpa Men to build your party.",2012,,http://static.giantbomb.com/uploads/scale_small/0/8960/2350717-denpamen.jpg,Role-Playing,"Fantasy, Comedy",Nintendo,Nintendo 3DS eShop,Genius Sonority
The Legend of Heroes: Trails in the Sky,http://www.giantbomb.com/the-legend-of-heroes-trails-in-the-sky/3030-5104/,The first game in the Legend of Heroes VI Sora no Kiseki trilogy. Follow Estelle and Joshua Bright on their journey to become Senior Bracers.,2004,5,http://static.giantbomb.com/uploads/scale_small/8/87790/2484713-box_tlohtits.png,Role-Playing,Fantasy,"Sony, PC","PlayStation Portable, PlayStation 3, PC, PlayStation Network (PSP), PlayStation Vita, PlayStation Network (Vita)",Nihon Falcom
The Legend of Zelda,http://www.giantbomb.com/the-legend-of-zelda/3030-11949/,A young boy explores a huge overworld filled with enemies and dungeons to find and rescue Princess Zelda from the evil Ganon.,1986,4.33,http://static.giantbomb.com/uploads/scale_small/0/26/10169-legendofzelda-goldbox.png,"Action, Adventure",Fantasy,Nintendo,"Game Boy Advance, Nintendo Entertainment System, Wii Shop, Famicom Disk System, Nintendo 3DS eShop, Wii U",Nintendo
The Legend of Zelda Wii U (Working Title),http://www.giantbomb.com/the-legend-of-zelda-wii-u-working-title/3030-41355/,The first original installment of the Zelda series in HD on the Wii U goes back to open world design with a focus on free exploration of a large scale environment and dangerous enemies.,2015,,http://static.giantbomb.com/uploads/scale_small/8/82063/2644081-loz.jpg,"Action, Adventure",Fantasy,Nintendo,Wii U,Nintendo
The Legend of Zelda: A Link Between Worlds,http://www.giantbomb.com/the-legend-of-zelda-a-link-between-worlds/3030-42402/,The first original The Legend of Zelda game on the Nintendo 3DS and also a direct sequel to The Legend of Zelda: A Link to the Past set six generations after.,2013,5,http://static.giantbomb.com/uploads/scale_small/8/82063/2537465-albwcleanbox.jpg,"Action, Adventure","Fantasy, Medieval",Nintendo,"Nintendo 3DS, Nintendo 3DS eShop","Nintendo, Monolith, SRD"
The Legend of Zelda: A Link to the Past,http://www.giantbomb.com/the-legend-of-zelda-a-link-to-the-past/3030-10276/,"The third installment in the Zelda series makes a return to the top-down 2D gameplay found in the first game. This time around, Link needs to travel between the light and dark world in order to set things straight in the kingdom of Hyrule.",1991,4.75,http://static.giantbomb.com/uploads/scale_small/9/93770/2363926-snes_thelegendofzeldaalinktothepast.jpg,"Action, Adventure",Fantasy,Nintendo,"Super Nintendo Entertainment System, Wii Shop, Wii U","Nintendo, SRD"
The Legend of Zelda: A Link to the Past & Four Swords,http://www.giantbomb.com/the-legend-of-zelda-a-link-to-the-past-four-swords/3030-35064/,A Game Boy Advance remake of the SNES classic featuring an all new Four Swords multiplayer component.,2002,,http://static.giantbomb.com/uploads/scale_small/11/112517/1775087-legend_of_zelda_a_link_to_the_past_four_swords_nintendo.jpg,"Action, Adventure",Fantasy,Nintendo,Game Boy Advance,"Flagship, Nintendo, SRD"
The Legend of Zelda: Four Swords Adventures,http://www.giantbomb.com/the-legend-of-zelda-four-swords-adventures/3030-7856/,"Create four-player mayhem to either vanquish the evil hordes of Vaati, or to blast each other into submission using the GBA link cable.",2004,4,http://static.giantbomb.com/uploads/scale_small/8/82063/2593599-fsaclean.jpg,"Action, Adventure",Fantasy,Nintendo,GameCube,Nintendo
The Legend of Zelda: Ocarina of Time,http://www.giantbomb.com/the-legend-of-zelda-ocarina-of-time/3030-12572/,"The Legend of Zelda: Ocarina of Time is considered to be one of the greatest games of all time, due in large part to the seamless unity between traditional Zelda gameplay and the bold, artistic, 3D environment in which it is presented.",1998,4.77,http://static.giantbomb.com/uploads/scale_small/8/87790/2204862-box_tlozoot.png,"Role-Playing, Action, Adventure",Fantasy,Nintendo,"Nintendo 64, Wii Shop",Nintendo
The Legend of Zelda: Ocarina of Time 3D,http://www.giantbomb.com/the-legend-of-zelda-ocarina-of-time-3d/3030-31776/,"The Hero of Time's classic adventure gets a 3D makeover in Ocarina of Time 3D, a fully remastered and enhanced handheld version of one of the highest rated video games of all time. Also includes a mirrored version of Ocarina of Time: Master Quest, originally only available in limited quantities for the GameCube.",2011,4.8,http://static.giantbomb.com/uploads/scale_small/8/82063/2630302-oot3d.jpg,"Action, Adventure",Fantasy,Nintendo,"Nintendo 3DS, Nintendo 3DS eShop","Grezzo, Nintendo"
The Legend of Zelda: Oracle of Ages,http://www.giantbomb.com/the-legend-of-zelda-oracle-of-ages/3030-8004/,One of a pair of Zelda games released simultaneously for the Game Boy Color. Oracle of Ages gives Link the ability to travel through time.,2001,5,http://static.giantbomb.com/uploads/scale_small/8/82063/2267400-236106-zelda_ooa.jpg,"Action, Adventure",Fantasy,Nintendo,"Game Boy Color, Nintendo 3DS eShop","Flagship, Pure Sound"
The Legend of Zelda: Oracle of Seasons,http://www.giantbomb.com/the-legend-of-zelda-oracle-of-seasons/3030-5895/,"The Legend of Zelda: Oracle of Seasons is one of the two Oracle games released on the Game Boy Color. It featured the ability to change the four seasons as Link went on a quest to save the Oracle of Seasons, Din.",2001,5,http://static.giantbomb.com/uploads/scale_small/8/82063/2267399-236040-zelda_oos.jpg,"Action, Adventure",Fantasy,Nintendo,"Game Boy Color, Nintendo 3DS eShop","Flagship, Pure Sound"
The Legend of Zelda: Phantom Hourglass,http://www.giantbomb.com/the-legend-of-zelda-phantom-hourglass/3030-3666/,"The first Zelda handheld game developed by Nintendo EAD since Link's Awakening, the game continues the story of Link and his Pirates to find a new Hyrule, but are detoured by a Ghost Ship. Controlled entirely by Touch Screen, it is one of the best selling games in the series.",2007,4.2,http://static.giantbomb.com/uploads/scale_small/8/87790/1970476-box_tlozph.png,"Action, Adventure",Fantasy,Nintendo,Nintendo DS,"Nintendo, SRD"
The Legend of Zelda: Skyward Sword,http://www.giantbomb.com/the-legend-of-zelda-skyward-sword/3030-26934/,"Link descends from his floating continent home to explore the dark and dangerous world below with the help of a magical sword, in this latest instalment of the Legend of Zelda series.",2011,4.32,http://static.giantbomb.com/uploads/scale_small/8/82063/2338815-skywardcolor.jpg,"Action, Adventure","Fantasy, Medieval",Nintendo,Wii,"Nintendo, Monolith, Nintendo, SRD"
The Legend of Zelda: Spirit Tracks,http://www.giantbomb.com/the-legend-of-zelda-spirit-tracks/3030-25657/,"Set 100 years after the events of The Wind Waker and Phantom Hourglass, Spirit Tracks introduces a new Hyrule where technology has advanced to the steam age, and an evil force, long-sealed in a tower, has been freed.",2009,3.95,http://static.giantbomb.com/uploads/scale_small/8/87790/1887914-box_tlozst.png,"Action, Adventure",Fantasy,Nintendo,Nintendo DS,"Nintendo, SRD"
The Legend of Zelda: The Minish Cap,http://www.giantbomb.com/the-legend-of-zelda-the-minish-cap/3030-6145/,Link dons a talking hat named Ezlo as he sets out on a quest to save Princess Zelda and defeat the evil wizard Vaati.,2004,4.17,http://static.giantbomb.com/uploads/scale_small/8/87790/2119736-box_tloztmc.png,"Action, Adventure",Fantasy,Nintendo,"Game Boy Advance, Nintendo 3DS eShop, Wii U","Flagship, Capcom"
The Legend of Zelda: Twilight Princess,http://www.giantbomb.com/the-legend-of-zelda-twilight-princess/3030-19467/,Link must rescue Zelda in TP,2006,4.18,http://static.giantbomb.com/uploads/scale_small/8/82063/2427157-tp2.jpg,"Action, Adventure","Fantasy, Medieval",Nintendo,"GameCube, Wii",Nintendo
The Magic of Scheherazade,http://www.giantbomb.com/the-magic-of-scheherazade/3030-9011/,"One of the first action RPGs, The Magic of Scheherazade was a Culture Brain title for the NES (1989) and Famicom (1987, as Arabian Dream Scheherazade).",1987,,http://static.giantbomb.com/uploads/scale_small/9/93770/2362026-nes_magicofscheherazade.jpg,"Action, Adventure, Role-Playing, Action, Adventure","Fantasy, Medieval",Nintendo,Nintendo Entertainment System,"Culture Brain, Micro Academy, Culture Brain"
