Joseph Chebet,Kenya,Male Winner,"New York City 1999, Boston 1999",http://en.wikipedia.org/wiki/Joseph_Chebet,,"Joseph Chebet (born August 23, 1970) was the winner of the 1999 Boston Marathon and the 1999 New York Marathon. He won in Boston in 1999 after losing to fellow KenyanMoses Tanui the year before by only three seconds.",1970,1999,29
Patrick Ivuti,Kenya,Male Winner,Chicago 2007,http://en.wikipedia.org/wiki/Patrick_Ivuti,//upload.wikimedia.org/wikipedia/commons/thumb/d/d9/2007_Chicago_Marathon_final_200M_-_men-2.JPG/250px-2007_Chicago_Marathon_final_200M_-_men-2.JPG,"Patrick Mukutu Ivuti (born June 30, 1978, Machakos, Kenya) is a Kenyan long distanceathlete, who currently resides in Nairobi, Kenya. A two-time silver medallist at the IAAF World Cross Country Championships, he made his marathon debut in 2005 and had his first major victory at the Chicago Marathon in 2007. He had back-to-back wins at the Honolulu Marathon in 2008–2009 and was the 2009 winner of the Prague Marathon.",1978,2007,29
Mary Keitany,Kenya,Female Winner,"London 2011, London 2012",http://en.wikipedia.org/wiki/Mary_Keitany,//upload.wikimedia.org/wikipedia/commons/thumb/9/9f/Mary_Keitany_nyc.jpg/220px-Mary_Keitany_nyc.jpg,"Mary Jepkosgei Keitany (born January 18, 1982 in Kisok, Baringo District) is a runner from Kenya who specialises in long distance running up to the marathon distance. She won silver at the 2007 IAAF World Road Running Championships and became the World Half Marathon champion two years later. She won the 2012 London Marathon with a personal best of 2:18:37 hours – making her the third fastest woman ever in the event.",1982,2011,29
Michael Kipyego,Kenya,Male Winner,Tokyo 2012,http://en.wikipedia.org/wiki/Michael_Kipyego,,Michael Kipkorir Kipyego (born 2 October 1983) is a Kenyan runner who competes in marathon races. He was initially a specialist in the 3000 metres steeplechase and was the 2002 World Junior Champion in the event. He represented Kenya in the steeplechase at the World Championships in 2003 and was runner-up at the 2008 African Championships. He set a personal best of 8:08.48 hours in 2009.,1983,2012,29
Priscah Jeptoo,Kenya,Female Winner,"London 2013, New York City 2013",http://en.wikipedia.org/wiki/Priscah_Jeptoo,//upload.wikimedia.org/wikipedia/commons/thumb/5/5f/SMdL_20110410_46775_Priscah_Jeptoo.jpg/180px-SMdL_20110410_46775_Priscah_Jeptoo.jpg,"Priscah Jeptoo (born 26 June 1984) is a Kenyanlong-distance runner who specialises in the marathon. She has won marathons in New York, Paris, Turin, and London and has a best time of 2:20:14 for the distance. She was the runner-up in the marathon at both the World Championships in Athletics in 2011 and the 2012 London Olympics. She ranks third all-time over the half marathon distance with her best of 66 minutes and 11 seconds (and 65:45 minutes on the Great North Run downhill course).",1984,2013,29
Dennis Kimetto,Kenya,Male Winner,"Tokyo 2013, Chicago 2013",http://en.wikipedia.org/wiki/Dennis_Kipruto_Kimetto,//upload.wikimedia.org/wikipedia/commons/thumb/e/e8/Berlin_marathon_2012_buelowstrasse_between_kilometers_36_and_37_30.09.2012_10-51-10.jpg/220px-Berlin_marathon_2012_buelowstrasse_between_kilometers_36_and_37_30.09.2012_10-51-10.jpg,Dennis Kipruto Kimetto or Dennis Kipruto Koech (born 22 January 1984) is a Kenyanlong distance runner who competes in road running events. He is the world record holder at the marathon and the 25 km road distance.,1984,2013,29
Simon Biwott,Kenya,Male Winner,Berlin 2000,http://en.wikipedia.org/wiki/Simon_Biwott,,"Simon Biwott (born March 3, 1970 in Eldoret, Uasin Gishu District) is a former long-distance runner from Kenya, who won the silver medal in the men's marathon at the 2001 World Championships in Athletics. The race in Edmonton, Canada was won by Ethiopias reigning Olympic champion Gezahegne Abera. A year later Biwott won the Rotterdam Marathon. He also won marathons in Cancún, Mexico City (1998), Berlin, Milan (2000), and Paris (2001). After his career in athletics he started a private school in Eldoret. His personal best of 2:06:49 was run at the 2002 edition of the Berlin Marathon.",1970,2000,30
Salim Kipsang,Kenya,Male Winner,Tokyo 2009,http://en.wikipedia.org/wiki/Salim_Kipsang,,"Salim Kipsang (born 22 December 1979) is a Kenyanlong-distancerunner, who specializes in the 10,000 metres and marathon.",1979,2009,30
Caroline Kilel,Kenya,Female Winner,Boston 2011,http://en.wikipedia.org/wiki/Caroline_Kilel,//upload.wikimedia.org/wikipedia/commons/thumb/d/d8/CarolineKilel.jpg/150px-CarolineKilel.jpg,"Caroline Cheptanui Kilel (born 21 March 1981) is a Kenyan long-distance runner who competes road running competitions, including the marathon. She was the winner at the 2011 Boston Marathon and the Frankfurt Marathon n 2010 and 2013.",1981,2011,30
Geoffrey Mutai,Kenya,Male Winner,"Berlin 2012, Boston 2011, New York City 2011, New York City 2013",http://en.wikipedia.org/wiki/Geoffrey_Mutai,//upload.wikimedia.org/wikipedia/commons/thumb/a/ab/Geoffrey_Mutai_NYC.jpg/220px-Geoffrey_Mutai_NYC.jpg,"Geoffrey Kiprono Mutai (born 7 October 1981) is a Kenyan long distance runner who specialises in road running competitions. On 18 April 2011 at the Boston Marathon, Mutai ran the fastest marathon ever at the time in a time of 2 hours 3 minutes 2 seconds (4:42 per mile pace), though the time was not recognised by the International Association of Athletics Federations as a world record since the Boston course does not meet the criteria to be eligible for the mark. His other significant victories include the Monaco Marathon. He is also a strong half marathon runner, with wins at the Valencia Half Marathon and RAK Half Marathon, and a best of 58 minutes 55 seconds, to his name. He also won the 2011 New York City Marathon with a time of 2 hours 5 minutes and 5 seconds (4:46 per mile pace), breaking the course record set by Tesfaye Jifar of Ethiopia in 2001, and repeated his performance at the 2013 New York City Marathon with a time of 2 hours 8 minutes and 24 seconds.",1981,2011,30
Wesley Korir,Kenya,Male Winner,Boston 2012,http://en.wikipedia.org/wiki/Wesley_Korir,//upload.wikimedia.org/wikipedia/commons/thumb/5/56/Wesley_Korir_of_Kenya_-_LA_Marathon_Winner_2009.jpg/220px-Wesley_Korir_of_Kenya_-_LA_Marathon_Winner_2009.jpg,"Wesley Korir (born 15 November 1982, in Kitale, Trans-Nzoia District) is a Kenyan elected Member of Parliament for Cherangany Constituency  (4 March 2013 elections) and a long distance runner who specializes in road running competitions. On 16 April 2012, he won the Boston Marathon with a time of 2 hours 12 minutes 40 seconds. He had previously won the Los Angeles Marathon in 2009 and 2010, the first back-to-back winner there in eight years. He took second place in the 2011Chicago Marathon in a personal-record time of 2 hours 6 minutes 15 seconds, and improved that personal record by 2 seconds in the 2012 Chicago Marathon. In 41334, Korir was elected to a seat in the Kenyan National Assembly.I remember telling God, Hallelujah. I've left the poverty land. I'm going to the land of riches. In my heart and head, I never thought I would go back.As I was going across the border, I looked at my cousin, who had to go back, and told him, bye bye. I won't see you again. I'm going to America and I'm going to be in America forever. That's what my heart was saying. But let me tell you, God had a different idea. When I said that, I believe God in heaven was laughing.Water is medicine. If you can get water, you get rid of 80 percent of our diseases. That's why water is the song I am going to sing for the next five years. I'll get money from the government. And I'll put as much money as possible in water projects. But it won't be enough. That's why I will partner with people. Every dollar people give us in our area, I'm going to match it.",1982,2012,30
Wilson Kipsang,Kenya,Male Winner,"London 2014, London 2012, Berlin 2013",http://en.wikipedia.org/wiki/Wilson_Kipsang,//upload.wikimedia.org/wikipedia/commons/thumb/2/26/Wilson_Kipsang_Kiprotich_2012_London_Marathon.jpg/220px-Wilson_Kipsang_Kiprotich_2012_London_Marathon.jpg,"Wilson Kipsang Kiprotich (born 15 March 1982) is a Kenyan athlete who specialises in long-distance running, competing in events ranging from 10 km to the marathon. He was the bronze medallist in the marathon at the 2012 Summer Olympics. He was former world record holder in the marathon with a time of 2:03:23, which he set at the 2013 Berlin Marathon. He has run under 2 hours 5 minutes for the marathon on five separate occasions.",1982,2012,30
Joseph Nzau,Kenya,Male Winner,Chicago 1983,http://en.wikipedia.org/wiki/Joseph_Nzau,,"Joseph Nzau (born April 14, 1952) is a Kenyan former long-distance runner who represented his country at the 1984 Summer Olympics in Los Angeles, California. Nzau won the 1983 Chicago Marathon and the inaugural 1990 Belgrade Marathon.",1952,1983,31
Sammy Lelei,Kenya,Male Winner,Berlin 1995,http://en.wikipedia.org/wiki/Sammy_Lelei,,"Sammy Lelei (born August 14, 1964) is a former long-distance runner from Kenya, who won the 1995 Berlin Marathon with a career best time of 2:07:02 hours. It was the fastest marathon time in 1995. This time stood as the Kenyan record for the event until 1998, when it was beaten by Ondoro Osoro.",1964,1995,31
Moses Tanui,Kenya,Male Winner,"Boston 1998, Boston 1996",http://en.wikipedia.org/wiki/Moses_Tanui,//upload.wikimedia.org/wikipedia/commons/thumb/6/66/Mosestanui.jpg/150px-Mosestanui.jpg,"Moses Tanui (born 20 August 1965 in Nandi District, Kenya) is a former Kenyanlong-distance runner who won the gold medal over 10000 m at the 1991 World Championships in Athletics in Tokyo.",1965,1996,31
Elijah Lagat,Kenya,Male Winner,"Berlin 1997, Boston 2000",http://en.wikipedia.org/wiki/Elijah_Lagat,,"Elijah Kiptarbei Lagat (born June 19, 1966) was born and raised in Saniak Village in Nandi District. He was the winner of the 104th running of the Boston Marathon held in 2000. He won in the closest finish in the race's history when he edged out Gezahgne Abera of Ethiopia and fellow Kenyan and previous year's champion, Moses Tanui. Abera and Lagat were both clocked at 2 hours 9 minutes and 47 seconds while Tanui finished three seconds back. Lagat's win enabled the Kenyans to capture the individual men's Boston Marathon title for the 10th straight year. This is a record that still stands.",1966,1997,31
Ondoro Osoro,Kenya,Male Winner,Chicago 1998,http://en.wikipedia.org/wiki/Ondoro_Osoro,,Ondoro Osoro (born 3 December 1967) is a former Kenyanlong-distance runner who competed mostly in cross country and road races.,1967,1998,31
Daniel Njenga,Kenya,Male Winner,Tokyo 2007,http://en.wikipedia.org/wiki/Daniel_Njenga,//upload.wikimedia.org/wikipedia/commons/thumb/f/f3/Flickr_-_matsubokkuri_-_DSC_8343.jpg/250px-Flickr_-_matsubokkuri_-_DSC_8343.jpg,"Daniel Njenga Muturi (born 7 May 1976) is a Kenyanlong-distancerunner, who specializes in the marathon.",1976,2007,31
Edna Kiplagat,Kenya,Female Winner,"London 2014, New York City 2010",http://en.wikipedia.org/wiki/Edna_Kiplagat,//upload.wikimedia.org/wikipedia/commons/thumb/5/51/Edna_Kiplagat_Moscow_2013.jpg/220px-Edna_Kiplagat_Moscow_2013.jpg,"Edna Ngeringwony Kiplagat (born 15 September 1979) is a Kenyan long-distance runner. She is the 2011 and 2013 IAAF World Champion in the marathon. She established herself as an elite marathon runner with wins at the Los Angeles and New York City Marathons in 2010. Her personal best for the distance is 2:19:50 hours, set at the London Marathon in 2012.",1979,2010,31
Salina Kosgei,Kenya,Female Winner,Boston 2009,http://en.wikipedia.org/wiki/Salina_Kosgei,//upload.wikimedia.org/wikipedia/commons/thumb/e/e3/Salina_Kosgei.jpg/220px-Salina_Kosgei.jpg,"Salina Jebet Kosgei (born 16 November 1976 in Simotwo, Keiyo District) is a long distance runner from Kenya. She is a Commonwealth Games gold medalist, has competed at the Olympics and has won various marathons, including the 2009 Boston Marathon.",1976,2009,33
Paul Tergat,Kenya,Male Winner,"New York City 2005, Berlin 2003",http://en.wikipedia.org/wiki/Paul_Tergat,//upload.wikimedia.org/wikipedia/commons/e/ec/World_Food_Program_2.jpg,"Paul Kibii Tergat (born June 17, 1969) is a Kenyan professional long distance runner. He held the world record in the marathon from 2003 to 2007, with a time of 2:04:55, and is regarded as one of the most accomplished long-distance runners of all time.",1969,2003,34
Ben Kimondiu,Kenya,Male Winner,Chicago 2001,,,,,,
Joseph Ngolepus,Kenya,Male Winner,Berlin 2001,,,,,,
Philip Manyim,Kenya,Male Winner,Berlin 2005,,,,,,
Raymond Kipkoech,Kenya,Male Winner,Berlin 2002,,,,,,
John Kagwe,Kenya,Male Winner,"New York City 1998, New York City 1997",,,,,,
Jeļena Prokopčuka,Latvia,Female Winner,"New York City 2006, New York City 2005",http://en.wikipedia.org/wiki/Je%C4%BCena_Prokop%C4%8Duka,//upload.wikimedia.org/wikipedia/commons/thumb/0/0d/Jelena_Prokopcuka_at_the_2007_Boston_Marathon.jpg/210px-Jelena_Prokopcuka_at_the_2007_Boston_Marathon.jpg,"Jeļena Prokopčuka (née Čelnova; born 21 September 1976 in Riga, Latvia) is a Latvian long-distancerunner, best known for winning the New York City Marathon in 2005 and 2006.",1976,2005,29
Germán Silva,Mexico,Male Winner,"New York City 1994, New York City 1995",http://en.wikipedia.org/wiki/Germ%C3%A1n_Silva,,"Germán Silva Martínez (born 9 January 1968 in Zacatlán, Puebla) is a retired Mexicanlong-distance runner who specialized in the marathon. His foremost achievements were back-to-back victories at the New York City Marathon in 1994 and 1995. He represented Mexico twice at the Summer Olympics, competing in 1992 and 1996. He also competed at the World Championships in Athletics on two occasions. His personal best for the marathon is 2:08:56 hours.",1968,1994,26
Adriana Fernandez,Mexico,Female Winner,New York City 1999,http://en.wikipedia.org/wiki/Adriana_Fernandez,,"Adriana Fernández Miranda (born April 4, 1971 in Mexico City) is a long-distance runner from México.",1971,1999,28
Salvador García,Mexico,Male Winner,New York City 1991,http://en.wikipedia.org/wiki/Salvador_Garc%C3%ADa_(athlete),,Salvador García (Salvador García Melchor; born 1 November 1962) is a Mexicanmarathon runner who won the New York Marathon in 1991 in a time of 2:09:28. He also won the 1992 Rotterdam Marathon in a time of 2:09:16. Other notable wins include the 1988 Mexico City Marathon (2:19.02) and the 1991 Long Beach Marathon (2:16.08). He finished second in the 1990 New York marathon with a time of 2:13.19.,1962,1991,29
Dionicio Cerón,Mexico,Male Winner,"London 1994, London 1996, London 1995",http://en.wikipedia.org/wiki/Dionicio_Cer%C3%B3n,,"Dionicio Cerón Pizarro (born October 9, 1965 in Toluca) is a former marathonrunner from Mexico, whose personal best in the classic distance was 2:08:30. He represented his native country two times at the Summer Olympics: in 1992 and 1996. He also won the London Marathon three consecutive times between 1994 and 1996, the only athlete to have achieved this feat.",1965,1994,29
Martín Pitayo,Mexico,Male Winner,Chicago 1990,http://en.wikipedia.org/wiki/Mart%C3%ADn_Pitayo,,"Martín Pitayo Martínez (born January 10, 1960) is a retired long-distance runner from Mexico, who won the gold medal at the 1991 Pan American Games in Havana, Cuba. He also won the 1990 edition of the Chicago Marathon, clocking 2:09:41.",1960,1990,30
Andrés Espinosa,Mexico,Male Winner,New York City 1993,http://en.wikipedia.org/wiki/Andr%C3%A9s_Espinosa,//upload.wikimedia.org/wikipedia/commons/thumb/e/e4/28af1.jpg/220px-28af1.jpg,"Andrés Espinosa Pérez (born 4 February 1963 in Monclova, Coahuila) is a retired Mexican long-distance runner who specialized in marathon races.",1963,1993,30
Alejandro Cruz,Mexico,Male Winner,Chicago 1988,,,,,,
Abdelkader El Mouaziz,Morocco,Male Winner,"London 2001, London 1999, New York City 2000",http://en.wikipedia.org/wiki/Abdelkader_El_Mouaziz,,"Abdelkader El Mouaziz (born 1 January 1969) is a Moroccan long-distance runner. He holds the record for the most sub 2:10 marathon runs at 13 (as of September 2007), now tied with Stefano Baldini. El Mouaziz is a two-time winner of the London Marathon, in 1999 and 2001, and was the runner-up in 2000. He also won the 1994 Madrid Marathon and the New York City Marathon in 2000. He was fifth at the 2002 Chicago Marathon.",1969,1999,30
Khalid Khannouchi,"Morocco, United States",Male Winner,"Chicago 2000, Chicago 1999, Chicago 1997, Chicago 2002, London 2002",http://en.wikipedia.org/wiki/Khalid_Khannouchi,//upload.wikimedia.org/wikipedia/commons/thumb/a/af/20071103_Khalid_Khannouchi-2.jpg/220px-20071103_Khalid_Khannouchi-2.jpg,"Khalid Khannouchi (Arabic: خالد خنّوشي‎) (born September 12, 1971) is a Moroccan Americanmarathoner. He was born in Meknes, Morocco. He is the former world record holder for the marathon and held the former road world best for the 20 km distance. He is one of only five men to break the marathon world record more than once, and one of only four to break their own marathon world record. (The others are Jim Peters, Derek Clayton, and Haile Gebrselassie.)",1971,1997,26
Dave McKenzie,New Zealand,Male Winner,Boston 1967,http://en.wikipedia.org/wiki/Dave_McKenzie_(marathon_runner),//upload.wikimedia.org/wikipedia/commons/thumb/3/3e/Flag_of_New_Zealand.svg/30px-Flag_of_New_Zealand.svg.png,"Dave McKenzie (David Closs McKenzie; born March 16, 1943 in Dunollie, Grey District) is a former long-distance runner from New Zealand, who represented his native country in the men's marathon at two consecutive Summer Olympics, starting in Mexico City (1968). He also won the Boston Marathon in 1967.",1943,1967,24
Allison Roe,New Zealand,Female Winner,"Boston 1981, New York City 1981",http://en.wikipedia.org/wiki/Allison_Roe,,"Allison Pamela Roe, MBE (née Deed; born 30 May 1956 in Auckland) is a former long-distance athlete from New Zealand. In 1981 she won both the Boston and New York Marathons in course record times. Later that year she broke the world record at the New York City Marathon and set a 20 km world record in Miyazaki, Japan.",1956,1981,25
Lorraine Moller,New Zealand,Female Winner,Boston 1984,http://en.wikipedia.org/wiki/Lorraine_Moller,,"Lorraine Mary Moller, MBE (born 1 June 1955 in Putaruru), is a former athlete from New Zealand, who competed in track athletics and later specialised in the marathon. Moller's international career lasted over 20 years and included three Commonwealth and four Olympic Games. She won the bronze medal in the marathon at the 1992 Summer Olympics in Barcelona at the age of 37.",1955,1984,29
Rod Dixon,New Zealand,Male Winner,New York City 1983,http://en.wikipedia.org/wiki/Rod_Dixon,,"Rodney Phillip ""Rod"" Dixon (born 13 July 1950) is a former New Zealand middle- to long-distance runner. He won the bronze medal in the 1500 metres at the 1972 Olympics in Munich, and in 1983 won the prestigious New York City Marathon.",1950,1983,33
Grete Waitz,Norway,Female Winner,"London 1983, London 1986, New York City 1980, New York City 1982, New York City 1979, New York City 1978, New York City 1986, New York City 1985, New York City 1984, New York City 1983, New York City 1988",http://en.wikipedia.org/wiki/Grete_Waitz,//upload.wikimedia.org/wikipedia/en/thumb/c/cb/Grete_Waitz_in_D%C3%BCsseldorf_1977.jpg/220px-Grete_Waitz_in_D%C3%BCsseldorf_1977.jpg,"Grete Waitz (née Andersen, 1 October 1953 – 19 April 2011) was a Norwegianmarathonrunner and former world record holder. In 1979, she became the first woman in history to run the marathon in under two and a half hours. She won nine New York City Marathons between 1978 and 1988, more than any other runner in history. She won a silver medal at the 1984 Olympic Games in Los Angeles and a gold medal at the 1983 World Championships in Helsinki. Her other marathon victories included winning the London Marathon in 1983 and 1986. She was also a five-time winner of the World Cross Country Championships.",1953,1978,25
Inge Simonsen,Norway,Male Winner,London 1981,http://en.wikipedia.org/wiki/Inge_Simonsen,//upload.wikimedia.org/wikipedia/commons/thumb/b/ba/Inge_Simonsen.jpg/220px-Inge_Simonsen.jpg,"Inge Simonsen (born 1 July 1953) is a Norwegian distance runner who tied for first place in the inaugural 1981 London Marathon. In that race, he and the other winner, American Dick Beardsley, intentionally crossed the finish line, in 2:11:48, holding hands in a dead heat. According to Beardsley, ""It was a big deal for both of us because neither one of us had won a marathon before.""",1953,1981,28
Ingrid Kristiansen,Norway,Female Winner,"Boston 1989, Boston 1986, Chicago 1986, London 1984, London 1988, London 1987, London 1985, New York City 1989",http://en.wikipedia.org/wiki/Ingrid_Kristiansen,,"Ingrid Kristiansen (née Christensen, born 21 March 1956) is a Norwegian former athlete. She was one of the best female long distance runners during the 1980s. She is a former world record holder in the 5000 metres, 10,000 metres and the marathon and was a World Champion on the track, roads and cross-country. Kristiansen was the first athlete to win World titles on all three surfaces. At the 1984 Los Angeles Olympics, she finished fourth in the first women's Olympic marathon. At the 1988 Seoul Olympics, she dropped out of the 10,000 metres final while leading. Early in her career, she was also an elite cross country skier, winning several Norwegian titles and a European junior championship.",1956,1984,28
Małgorzata Sobańska,Poland,Female Winner,London 1995,http://en.wikipedia.org/wiki/Ma%C5%82gorzata_Soba%C5%84ska,,"Małgorzata Sobańska-Mańkowska (born April 25, 1969 in Poznań, Wielkopolskie) is a retired female long-distance runner from Poland. She twice competed for her native country at the Summer Olympics: in 1996 and 2004.",1969,1995,26
Renata Kokowska,Poland,Female Winner,"Berlin 1991, Berlin 1988, Berlin 1993",http://en.wikipedia.org/wiki/Renata_Kokowska,,"Renata Kokowska (born December 4, 1958 in Głubczyn) is a former long-distance runner from Poland, who is a triple winner of the Berlin Marathon: 1988, 1991 and 1993. In 1990 she triumphed in the Amsterdam Marathon. She is a two-time national champion in the women's 5.000 metres.",1958,1988,30
Wanda Panfil,Poland,Female Winner,"Boston 1991, London 1990, New York City 1990",http://en.wikipedia.org/wiki/Wanda_Panfil,,"Wanda Marianna Panfil-González (born 26 January 1959 in Tomaszów Mazowiecki) is a former long-distance runner from Poland, who won the world title in the women's marathon at the 1991 World Championships in Athletics in Tokyo, Japan. She is married to Mexican long-distance runner Mauricio González.",1959,1990,31
Bogusław Psujek,Poland,Male Winner,Berlin 1986,,,,,,
Rosa Mota,Portugal,Female Winner,"Boston 1990, Boston 1988, Boston 1987, Chicago 1983, Chicago 1984, London 1991",http://en.wikipedia.org/wiki/Rosa_Mota,//upload.wikimedia.org/wikipedia/commons/thumb/1/18/Rosa_Mota_na_Exponor.JPG/220px-Rosa_Mota_na_Exponor.JPG,"Rosa Maria Correia dos Santos Mota (Portuguese pronunciation: [ˈʁɔzɐ ˈmɔtɐ], GCIH, GCM; born June 29, 1958) is a Portuguese former marathon runner, one of her country's foremost athletes, being the first sportswoman from Portugal to win Olympic gold. Mota was the first woman to win multiple Olympic marathon medals as well as being the only woman to be the reigning European, World, and Olympic champion at the same time. On the 30th Anniversary Gala of the Association of International Marathons and Distance Races (AIMS) she was distinguished as the greatest female marathon runner of all time.",1958,1983,25
António Pinto,Portugal,Male Winner,"London 1997, Berlin 1994, London 1992, London 2000",http://en.wikipedia.org/wiki/Ant%C3%B3nio_Pinto_(athlete),,"António Coelho Pinto (born 22 March 1966 in Vila Garcia, Amarante) is a Portugueselong-distancerunner.",1966,1992,26
Aurora Cunha,Portugal,Female Winner,Chicago 1990,http://en.wikipedia.org/wiki/Aurora_Cunha,,"Aurora Cunha (born May 31, 1959 in Ronfe, near Guimarães) is a retired long-distance runner from Portugal, living in Póvoa de Varzim. From 1984-1992 she represented her native country in three consecutive Olympic Games. Cunha's greatest successes were in road running, at which she was a three-time World Champion. She also won several marathons during her career, including Paris (1988), Tokyo (1988), Chicago (1990) and Rotterdam (1992).",1959,1990,31
Anuţa Cătună,Romania,Female Winner,New York City 1996,http://en.wikipedia.org/wiki/Anu%C5%A3a_C%C4%83tun%C4%83,,"Anuţa Cătună (born October 1, 1968 in Lunca Ilvei, Bistriţa-Năsăud) is a former female long-distance runner from Romania, who represented her native country at two consecutive Summer Olympics, starting in 1996. She won the 1996 edition of the New York City Marathon.",1968,1996,28
Constantina Diţă-Tomescu,Romania,Female Winner,Chicago 2004,http://en.wikipedia.org/wiki/Constantina_Di%C5%A3%C4%83-Tomescu,//upload.wikimedia.org/wikipedia/commons/thumb/2/2d/Constantina_Dita.jpg/260px-Constantina_Dita.jpg,"Constantina Diţă (formerly Constantina Diţă-Tomescu born on January 23, 1970 in Turburea, Gorj County), is a Romanianlong-distancerunner, who specializes mainly in the half marathon and marathon.",1970,2004,34
Olga Markova,Russia,Female Winner,"Boston 1993, Boston 1992",http://en.wikipedia.org/wiki/Olga_Markova_(athlete),,"Olga Markova (Russian: Ольга Маркова; born August 6, 1968) is a retired long-distance runner from Russia, who set the world's best year performance in 1992, when she won the Boston Marathon, clocking 2:23:43. In 1993, she defended her victory in Boston in 2:25:27.",1968,1992,24
