Alevtina Biktimirova,Russia,Female Winner,Tokyo 2010,http://en.wikipedia.org/wiki/Alevtina_Biktimirova,//upload.wikimedia.org/wikipedia/commons/thumb/a/a1/Alevtina_Biktimirova_during_2013_London_Marathon_%283%29.JPG/220px-Alevtina_Biktimirova_during_2013_London_Marathon_%283%29.JPG,"Alevtina Biktimirova (born September 10, 1982) is a Russianlong-distancerunner, who specialises in the marathon.",1982,2010,28
Lyudmila Petrova,Russia,Female Winner,New York City 2000,http://en.wikipedia.org/wiki/Lyudmila_Petrova,,"Lyudmila Nikolayevna Petrova (Russian: Людмила Николаевна Петрова; born 7 October 1968) is a Russianlong-distance runner, who represented her native country at two Summer Olympics: 1996 and 2004. She won the 2000 edition of the New York City Marathon.",1968,2000,32
Liliya Shobukhova,Russia,Female Winner,"Chicago 2011, Chicago 2010, Chicago 2009, London 2010",http://en.wikipedia.org/wiki/Liliya_Shobukhova,//upload.wikimedia.org/wikipedia/commons/thumb/7/74/Liliya_Shobukhova%2C_London_Marathon_2011_%28cropped%29.jpg/250px-Liliya_Shobukhova%2C_London_Marathon_2011_%28cropped%29.jpg,"Liliya Bulatovna Shobukhova (Russian: Лилия Булатoвнa Шoбухова, née Russian: Шагбaлова, Shabalova; born 13 November 1977) is a Russianlong-distance runner who competed in marathon races. She previously specialized in the 3000 and 5000 metrestrack events.",1977,2009,32
Svetlana Zakharova,Russia,Female Winner,"Boston 2003, Chicago 2003",http://en.wikipedia.org/wiki/Svetlana_Zakharova_(athlete),//upload.wikimedia.org/wikipedia/commons/thumb/3/36/Frankfurt-marathon2007-031.jpg/220px-Frankfurt-marathon2007-031.jpg,"Svetlana Vladimirovna Zakharova (Russian: Светлана Владимировна Захарова), (born 15 September 1970 in Chuvashia) is a Russianlong-distance runner, who specializes in marathon races. She won several international marathons, such as: the Honolulu Marathon (1997, 2002 and 2009), the Chicago Marathon (2003) and the Boston Marathon (2003). She participated twice in the Olympic Games.",1970,2003,33
Lidiya Grigoryeva,Russia,Female Winner,"Boston 2007, Chicago 2008",http://en.wikipedia.org/wiki/Lidiya_Grigoryeva,//upload.wikimedia.org/wikipedia/commons/thumb/1/15/Lidiya_Grigoryeva_at_the_2007_Boston_Marathon.jpg/220px-Lidiya_Grigoryeva_at_the_2007_Boston_Marathon.jpg,"Lidiya Grigoryeva (Russian: Лидия Григорьева; born January 25, 1974 in Smychka, Chuvash ASSR) is a Russianlong-distance runner from the Chuvashia region.",1974,2007,33
David Tsebe,South Africa,Male Winner,Berlin 1992,http://en.wikipedia.org/wiki/David_Tsebe,,"Kagiso (David) Tsebe (born 9 November 1966) is a retired marathon runner from South Africa. He won the 1992 edition of the Berlin Marathon on 27 September 1992, clocking 2:08:07. With that time Tsebe ended up in first place in the year rankings.",1966,1992,26
Xolile Yawa,South Africa,Male Winner,Berlin 1993,http://en.wikipedia.org/wiki/Xolile_Yawa,,"Xolile Yawa (born 29 September 1962 in Lady Frere, Eastern Cape) is a retired athlete from South Africa. He specialised in long-distance running, including marathons.",1962,1993,31
Colleen De Reuck,South Africa,Female Winner,Berlin 1996,http://en.wikipedia.org/wiki/Colleen_De_Reuck,//upload.wikimedia.org/wikipedia/commons/thumb/8/8f/Athletics_pictogram.svg/50px-Athletics_pictogram.svg.png,"Colleen S. De Reuck (born 13 April 1964 in Vryheid, Kwazulu-Natal) is a long-distance runner from South Africa, who became an American citizen on 11 December 2000. She has had a long-lasting career, running in her forties, and made a total of four appearances at the Summer Olympics.",1964,1996,32
Hendrick Ramaala,South Africa,Male Winner,New York City 2004,http://en.wikipedia.org/wiki/Hendrick_Ramaala,//upload.wikimedia.org/wikipedia/commons/thumb/e/e2/Berlin_marathon_2011_hendrick_ramalaa_seite.jpg/220px-Berlin_marathon_2011_hendrick_ramalaa_seite.jpg,Hendrik Ramaala (born 2 February 1972) is a South African long-distance runner.,1972,2004,32
Willie Mtolo,South Africa,Male Winner,New York City 1992,,,,,,
Ham Kee-Yong,South Korea,Male Winner,Boston 1950,http://en.wikipedia.org/wiki/Ham_Kee-Yong,,"Ham Kee-yong (born November 14, 1930) is a former South Korean athlete, best known as the winner of the 1950 Boston Marathon.",1930,1950,20
Suh Yun-bok,South Korea,Male Winner,Boston 1947,http://en.wikipedia.org/wiki/Suh_Yun-bok,,"Suh Yun-bok (born January 9, 1923) is a former South Korean athlete, who is best known as the winner of the 1947 Boston Marathon. He won the race with a world best time of 2:25:39 under the coach Sohn Kee-chung, the Korean winner of the marathon at the 1936 Berlin Olympics. His participation in the Boston Marathon was financed by donations from servicemen in the United States Forces Korea. His win was the first time a world best for the men's marathon was set at the Boston Marathon. The previous world best was set by his coach Sohn in Tokyo, Japan in 1935. At 166 cm tall (5'5"") and weighing 56 kg (123 lbs), he was said to be the shortest winner ever of the Boston Marathon.",1923,1947,24
Lee Bong-Ju,South Korea,Male Winner,Boston 2001,http://en.wikipedia.org/wiki/Lee_Bong-Ju,,"Lee Bong-Ju (Hangul: 이봉주; hanja: 李鳳柱; born October 11, 1970 in Cheonan, Chungcheongnam-do, South Korea) is a South Koreanmarathoner.",1970,2001,31
Yakov Tolstikov,Soviet Union,Male Winner,London 1991,http://en.wikipedia.org/wiki/Yakov_Tolstikov,,"Yakov Tolstikov (born 20 May 1959 in Prokopyevsk) is a former Russian distance runner. Tolstivov rose to worldwide prominence following his surprise upset of favorite Gelindo Bordin in the 1991 London Marathon. The next year, he competed in the 1992 Summer Olympics in Barcelona, Spain, coming in a distant and disappointing 22nd.",1959,1991,32
Abel Antón,Spain,Male Winner,"London 1998, Berlin 1996",http://en.wikipedia.org/wiki/Abel_Ant%C3%B3n,//upload.wikimedia.org/wikipedia/commons/thumb/8/8f/Abel_Ant%C3%B3n_%28Feria_del_Libro_de_Madrid%2C_6_de_junio_de_2008%29.jpg/250px-Abel_Ant%C3%B3n_%28Feria_del_Libro_de_Madrid%2C_6_de_junio_de_2008%29.jpg,"Abel Antón Rodrigo (born 24 October 1962 in Ojuel, Soria) is a Spanish long-distance runner. He won gold medals in the marathon at the 1997 and the 1999 World Championships in Athletics. In 1998 Antón became the first Spanish runner to win the London Marathon. He also won the 10.000 m title at the 1994 European Championships in Athletics.",1962,1996,34
Midde Hamrin,Sweden,Female Winner,Chicago 1991,http://en.wikipedia.org/wiki/Midde_Hamrin,,"Midde Hamrin (Ingrid Marie-Louise Hamrin; born April 19, 1957 in Gothenburg, Västra Götaland) is a Swedishathlete, competing in the long-distance running events.",1957,1991,34
Karl Leandersson,Sweden,Male Winner,Boston 1949,,,,,,
Franziska Rochat-Moser,Switzerland,Female Winner,New York City 1997,http://en.wikipedia.org/wiki/Franziska_Rochat-Moser,,"Franziska Rochat-Moser (17 August 1966 – 7 March 2002) was a long-distance runner from Switzerland, who represented her native country at two consecutive Summer Olympics, starting in 1992. She won the 1997 edition of the New York City Marathon.",1966,1997,31
Viktor Röthlin,Switzerland,Male Winner,Tokyo 2008,http://en.wikipedia.org/wiki/Viktor_R%C3%B6thlin,//upload.wikimedia.org/wikipedia/commons/thumb/9/94/Viktor_R%C3%B6thlin.jpg/200px-Viktor_R%C3%B6thlin.jpg,"Viktor Röthlin (born October 14, 1974 in Kerns, Obwalden) is a Swisslong-distance runner, who specializes in the marathon.",1974,2008,34
Alfredo Shahanga,Tanzania,Male Winner,Berlin 1989,http://en.wikipedia.org/wiki/Alfredo_Shahanga,,"Alfredo Shahanga (born April 14, 1965) is a retired long-distance runner from Tanzania, who won the 1989 edition of the Vienna Marathon. In the same year he triumped at the 16th Berlin Marathon on October 1 in a time of 2:10:11. Shahanga represented his native country in the men's marathon at the 1991 World Championships in Tokyo, Japan.",1965,1989,24
Juma Ikangaa,Tanzania,Male Winner,New York City 1989,http://en.wikipedia.org/wiki/Juma_Ikangaa,,"Juma Ikangaa (born July 19, 1957 in Dodoma) is a marathon runner from Tanzania, a sentimental favorite in Boston after finishing second three years in a row at the Boston Marathon from 1988-1990. A great trainer, Ikangaa said ""The will to win means nothing without the will to prepare.""",1957,1989,32
Suleiman Nyambui,Tanzania,Male Winner,"Berlin 1987, Berlin 1988",http://en.wikipedia.org/wiki/Suleiman_Nyambui,//upload.wikimedia.org/wikipedia/commons/thumb/4/4b/Olympic_Games_1980_-_5000_m_race.jpg/200px-Olympic_Games_1980_-_5000_m_race.jpg,"Suleiman Nyambui (born February 13, 1953) is a former track athlete from Tanzania who specialized in various long-distance disciplines. Nyambui won the bronze medal at the 1978 All-Africa Games, the silver medal in 5000 metres at the 1980 Summer Olympics, and finished first at three consecutive marathons between 1987 and 1988. He holds multiple indoor national records of Tanzania in athletics.",1953,1987,34
Hugh Jones,United Kingdom,Male Winner,London 1982,http://en.wikipedia.org/wiki/Hugh_Jones_(athlete),,"Robin Evan Hugh Jones (born 1 November 1955, in London) is a retired British long distance runner. He attended Latymer Upper School in Hammersmith, where he began competing in long distance running both for the school and for Ranelagh Harriers, and the University of Liverpool.",1955,1982,27
Liz McColgan,United Kingdom,Female Winner,"London 1996, New York City 1991",http://en.wikipedia.org/wiki/Liz_McColgan,,"Elizabeth (""Liz"") McColgan-Nuttall (née Lynch) MBE (born 24 May 1964) is a Scottish former middle-distance and long-distancetrack and road-running athlete. She won the gold medal for the 10,000 metres at the 1991 World Championships, and a silver medal over the same distance at the 1988 Olympic Games. She was also a two-time gold medalist over the distance at the Commonwealth Games, as well as winning the World Half Marathon Championships, New York City Marathon, Tokyo Marathon and London Marathon.",1964,1991,27
Mike Gratton,United Kingdom,Male Winner,London 1983,http://en.wikipedia.org/wiki/Mike_Gratton,,"Michael (""Mike"") Colin Gratton (born 28 November 1954) is a former elite long distance runner from England, and a past winner of the London Marathon. A member of the Kent athletics club Invicta AC, he gained a bronze medal in the 1982 Commonwealth Games marathon (2:12:06). He won the 1983 London Marathon in a time of 2:09:43, a time which places him 13th on the UK all-time marathon list.",1954,1983,29
Steve Jones,United Kingdom,Male Winner,"New York City 1988, London 1985, Chicago 1985, Chicago 1984",http://en.wikipedia.org/wiki/Steve_Jones_(athlete),//upload.wikimedia.org/wikipedia/commons/thumb/4/40/Steve_Jones.jpg/220px-Steve_Jones.jpg,Stephen Henry Jones (born 4 August 1955) is a Welsh athlete and former world marathon record holder.,1955,1984,29
Paula Radcliffe,United Kingdom,Female Winner,"Chicago 2002, London 2003, London 2002, London 2005, New York City 2004, New York City 2008, New York City 2007",http://en.wikipedia.org/wiki/Paula_Radcliffe,//upload.wikimedia.org/wikipedia/commons/thumb/4/46/Paula_Radciffe_NYC_Marathon_2008_cropped.jpg/220px-Paula_Radciffe_NYC_Marathon_2008_cropped.jpg,"Paula Jane Radcliffe, MBE (born 17 December 1973) is an English long-distance runner. She is the current women's world record holder in the marathon with her time of 2:15:25 hours. She is a three-time winner of the London Marathon (2002, 2003, 2005), three-time New York Marathon champion (2004, 2007, 2008), and won the 2002 Chicago Marathon.""I'm not looking to make a living out of it. Obviously it's nice that there's a bit of money coming in but that's not my goal. I just want to do my best and still enjoy it. I want to keep on enjoying it, keep on improving, get as much out of it as I can and put as much back as I can.""""We should be pleased. One of the biggest frauds has been caught. Her medals should also be taken away""",1973,2002,29
Steve Brace,United Kingdom,Male Winner,Berlin 1991,http://en.wikipedia.org/wiki/Steve_Brace,,"Steve Brace (also written Steven or Stephen Brace; born 7 July 1961 in Bridgend) is a former long-distance runner from Wales, who represented the United Kingdom in the men's marathon at the 1992 and 1996 Summer Olympics. He finished in 27th (2:17:49) and in 60th (2:23.28) place respectively. Brace triumphed at the Paris Marathon in 1989 and 1990 and at the Berlin Marathon in 1991. His personal best is 2:10:35 (second place at the Houston Marathon 1996).",1961,1991,30
Geoff Smith,United Kingdom,Male Winner,"Boston 1985, Boston 1984",http://en.wikipedia.org/wiki/Geoff_Smith_(athlete),,"Geoffrey (""Geoff"") Smith (born 24 October 1953) is a British long-distance runner who won the Boston Marathon in both 1984 and 1985.",1953,1984,31
Charlie Spedding,United Kingdom,Male Winner,London 1984,http://en.wikipedia.org/wiki/Charlie_Spedding,,"Charles (""Charlie"") Spedding (born 19 May 1952 in Bishop Auckland, County Durham) is an English former long-distance runner. He was fourth in the 10,000m at the 1982 Commonwealth Games in Brisbane and was England’s Amateur Athletic Association (AAA) 10,000m champion in 1983 in a time of 28:08.12. His first marathon was the Houston Marathon in 1984, which he won by ""the thickness of a vest"".",1952,1984,32
Véronique Marot,United Kingdom,Female Winner,London 1989,http://en.wikipedia.org/wiki/V%C3%A9ronique_Marot,,"Marie-Véronique Antoinette Colette Jeannine Marot (born 16 September 1955) is a former marathonrunner from France who moved to England in 1976. She won the 1989London Marathon and represented Great Britain at the 1992 Olympic Games. Marot twice broke the British record for the marathon, with 2:28:04 in 1985 and 2:25:56 in 1989. The latter time stood as the UK record for thirteen years.",1955,1989,34
Eamonn Martin,United Kingdom,Male Winner,"London 1993, Chicago 1995",http://en.wikipedia.org/wiki/Eamonn_Martin,,"Eamonn Martin (born 9 October 1958 in Basildon, Essex) is a former elite long distance runner from England. The most recent British male winner of the London Marathon, he ran 02:10:50 to win the 1993 race in a sprint finish against the Mexican athlete Isidro Rico. That race was Martin’s debut marathon. He went on to win the Chicago Marathon in 1995 (2:11:18).",1958,1993,35
Paul Evans,United Kingdom,Male Winner,Chicago 1996,http://en.wikipedia.org/wiki/Paul_Evans_(athlete),,"Paul William Evans (born 13 April 1961) is a former distance runner from England, who ran in the 10000m track final at the 1992 Barcelona Olympics and 1996 Atlanta Olympics. He took up running at 25, having been a footballer. He was a member of Belgrave Harriers and the City of Norwich Athletics Club.",1961,1996,35
Allister Hutton,United Kingdom,Male Winner,London 1990,http://en.wikipedia.org/wiki/Allister_Hutton,,"Allister Hutton (born 18 July 1954) is former elite long-distance runner from Scotland, who won the London Marathon in 1990. He competed in three consecutive Commonwealth Games for Scotland during his career, starting in 1978.",1954,1990,36
Priscilla Welch,United Kingdom,Female Winner,New York City 1987,http://en.wikipedia.org/wiki/Priscilla_Welch,,"Priscilla June Welch (born 22 November 1944 in Bedford, England) is a British retired marathonrunner. She had a most unlikely career in international athletics, having been a smoker of a pack a day until she began running competitively at age 35. An officer in the British Army, Welch met her husband Dave while serving in Norway. She quit smoking, and under his tutelage, she ran in the 1980 London Marathon at age 35.",1944,1987,43
Joyce Smith,United Kingdom,Female Winner,"London 1981, London 1982",http://en.wikipedia.org/wiki/Joyce_Smith,,"Joyce Esther Smith (born Joyce Esther Byatt, 26 October 1937) is a British former long-distance runner.",1937,1981,44
Jimmy Ashworth,United Kingdom,Male Winner,Berlin 1985,http://en.wikipedia.org/wiki/Jimmy_Ashworth,,"James Joseph ""Jimmy"" Ashworth (1918–1990) was an Irish footballer. His only known club was Blackpool, for whom he made four Football League appearances in 1938.",1918,1985,67
Jean Lochhead,United Kingdom,Female Winner,Berlin 1982,,,,,,
Karen Holdsworth,United Kingdom,Female Winner,Berlin 1983,,,,,,
Marian Sutton,United Kingdom,Female Winner,"Chicago 1997, Chicago 1996",,,,,,
Ian Ray,United Kingdom,Male Winner,Berlin 1981,,,,,,
Paul Davies-Hale,United Kingdom,Male Winner,Chicago 1989,,,,,,
Ron Hill,United Kingdom,Male Winner,Boston 1970,,,,,,
Beth Bonner,United States,Female Winner,New York City 1971,http://en.wikipedia.org/wiki/Beth_Bonner,,"Beth Bonner (Elizabeth Bonner; June 9, 1952 - October 9, 1998) was a long-distance runner from Reedsville, West Virginia. On May 9, 1971, Bonner ran a 3:01:42 marathon time in Philadelphia at the AAU Eastern Regional Championships, breaking the world best set one year earlier by Caroline Walker. On September 19, 1971, she became the first winner of the women's division of the New York City Marathon at the age of 19. Some sources question the validity of Adrienne Beames 2:46:30 time one month earlier, so Bonner's 2:55:22 performance at New York is frequently credited as the first sub-three hour performance by a woman.",1952,1971,19
Kim Merritt,United States,Female Winner,"Boston 1976, New York City 1975",http://en.wikipedia.org/wiki/Kim_Merritt,,"Kim Merritt (born May 22, 1955 in Racine, Wisconsin) is a former Americanlong-distance runner who competed in the marathon. Her career coincided with the development of women's running in the United States and she was at the forefront of distance running in the mid-1970s.",1955,1975,20
Frederick Lorz,United States,Male Winner,Boston 1905,http://en.wikipedia.org/wiki/Frederick_Lorz,//upload.wikimedia.org/wikipedia/commons/thumb/4/42/Frederick_Lorz_1904_olympics.jpg/220px-Frederick_Lorz_1904_olympics.jpg,"Frederick ""Fred"" Lorz (June 5, 1884 – February 4, 1914) was an Americanlong distance runner who won the 1905 Boston Marathon. Lorz is also known for his ""finish"" in the marathon at the 1904 Summer Olympics.",1884,1905,21
Sammy Mellor,United States,Male Winner,Boston 1902,http://en.wikipedia.org/wiki/Sammy_Mellor,,"Samuel Alexander ""Sammy"" Mellor, Jr. (March 14, 1880 – November 5, 1948)[nb 1] was an American long-distance runner who won the 1902 Boston Marathon and competed in the marathon at the 1904 Summer Olympics in St. Louis, Missouri.",1880,1902,22
Ellison Brown,United States,Male Winner,"Boston 1936, Boston 1939",http://en.wikipedia.org/wiki/Ellison_Brown,,"Ellison Myers Brown (September 22, 1914 – August 23, 1975), widely known as Tarzan Brown, and Deerfoot amongst his people, was a two-time winner of the Boston Marathon in 1936 (2:33:40) and 1939 (2:28:51). A member and direct descendant of the royal family of the Narragansett Indian tribe of Rhode Island, he also participated in the 1936 Summer Olympics in Berlin. He was scheduled to participate in the 1940 Summer Olympics in Helsinki, but these were canceled due to the outbreak of World War II. Tarzan Brown is still one of only two Native Americans to have won the Boston Marathon (the other was Thomas Longboat of the Onondaga Nation in 1907) and the only Native American to have more than one victory in Boston. He was inducted into the American Indian Athletic Hall of Fame in 1973.",1914,1936,22
Amby Burfoot,United States,Male Winner,Boston 1968,http://en.wikipedia.org/wiki/Amby_Burfoot,,"Ambrose (""Amby"") Joel Burfoot (born August 19, 1946) is an American marathoner, whose peak competitive years came in the late 1960s and early 1970s. He was the winner of the 1968 Boston Marathon. After retiring from competition, he became a running journalist and author. Burfoot was the top editor (editor-in-chief) at Runner’s World for many years and both writes for Runner’s World and serves as editor-at-large.",1946,1968,22
Tom Fleming,United States,Male Winner,"New York City 1975, New York City 1973",http://en.wikipedia.org/wiki/Tom_Fleming_(athlete),,"Tom Fleming (born July 23, 1951) is an American runner who won the 1973 and 1975 New York City Marathon. He was also a two time runner-up in the Boston Marathon in 1973 and 1974 and finished six times in the top ten in the BAA marathon. Fleming was the winner of the Cleveland, Toronto, Los Angeles, Jersey Shore (3 times) and Washington DC marathons in the 1970s. Gained personal best of 2:12:05 in Boston Marathon 1975. Renowned for running 110 to 150 miles per week to train for road racing. Awarded the United Nations Peace Medal in 1977. In May 2013, Fleming was inducted into the American RRCA Distance Running Hall of Fame. In July 2014, Fleming was inducted into the National Distance Running Hall of Fame in Utica, NY.",1951,1973,22
Joan Benoit Samuelson,United States,Female Winner,"Boston 1979, Boston 1983, Chicago 1985",http://en.wikipedia.org/wiki/Joan_Benoit_Samuelson,//upload.wikimedia.org/wikipedia/commons/thumb/9/9a/Joan_Benoit_2008.jpg/200px-Joan_Benoit_2008.jpg,"Joan Benoit Samuelson (born May 16, 1957) is an Americanmarathonrunner who won gold at the 1984 Summer Olympics in Los Angeles, the year that the women's marathon was introduced. As a result, she was the first-ever women's Olympic marathon champion. Benoit Samuelson still holds the fastest times for an American woman at the Chicago Marathon and the Olympic Marathon. Her time at the Boston Marathon was the fastest time by an American woman at that race for 28 years.",1957,1979,22
Alberto Salazar,United States,Male Winner,"New York City 1981, Boston 1982, New York City 1980, New York City 1982",http://en.wikipedia.org/wiki/Alberto_Salazar,//upload.wikimedia.org/wikipedia/commons/thumb/6/6c/Salazar_Eugene_08.JPG/225px-Salazar_Eugene_08.JPG,"Alberto Salazar (born August 7, 1958) is an Americantrack coach and retired long-distance runner. Born in Cuba, Salazar emigrated to the United States with his family. They moved to Wayland, Massachusetts, where Salazar competed in track and field in high school. Salazar is best known for his performances in the New York City Marathon in the early 1980s and his 1982 Boston Marathon victory known as ""Duel in the Sun."" He held American track records of 13:11.93 for 5,000 m (July 6, 1982 – Stockholm) and 27:25.61 for 10,000 m – (June 26, 1982 – Oslo).",1958,1980,22
Clarence DeMar,United States,Male Winner,"Boston 1911, Boston 1922, Boston 1923, Boston 1924, Boston 1927, Boston 1928, Boston 1930",http://en.wikipedia.org/wiki/Clarence_DeMar,//upload.wikimedia.org/wikipedia/commons/thumb/c/c4/Clarence_DeMar_1.jpg/180px-Clarence_DeMar_1.jpg,"Clarence Harrison DeMar (June 7, 1888 – June 11, 1958) was a U.S. marathoner, winner of seven Boston Marathons, and Bronze medalist at the 1924 Paris Olympics. He was known by the nickname ""Mr. DeMarathon.""",1888,1911,23
Michael J. Ryan,United States,Male Winner,Boston 1912,http://en.wikipedia.org/wiki/Michael_J._Ryan_(athlete),,"Michael J. ""Mike"" Ryan (January 1, 1889 – December 27, 1971) was an Americantrack and field athlete and a member of the Irish American Athletic Club. He was a distance runner and competed in the Marathon for the U.S. Olympic team in the 1908 Summer Olympics and 1912 Summer Olympics, but did not finish either race.",1889,1912,23
Bobbi Gibb,United States,Female Winner,"Boston 1968, Boston 1967, Boston 1966",http://en.wikipedia.org/wiki/Bobbi_Gibb,,"Roberta Louise ""Bobbi"" Gibb (born November 2, 1942 in Cambridge, Massachusetts) is the first woman to have run the entire Boston Marathon (1966). She is recognized by the Boston Athletic Association as the pre-sanctioned era women’s winner in 1966, 1967, and 1968. Gibb’s run in 1966 challenged prevalent prejudices and misconceptions about women's athletic capabilities.",1942,1966,24
Jon Anderson,United States,Male Winner,Boston 1973,http://en.wikipedia.org/wiki/Jon_Anderson_(athlete),,"Jon Peter Anderson (born October 12, 1949), a lifelong Eugene, Oregon resident, is a publisher, and runner best known for winning the 1973 Boston Marathon. Anderson was a competitive long-distancerunner from 1966 to 1984. He represented the United States as a member of the 1972 US Olympictrack and field team.",1949,1973,24
Lisa Larsen Weidenbach,United States,Female Winner,Boston 1985,http://en.wikipedia.org/wiki/Lisa_Larsen_Weidenbach,,"Lisa Larsen Rainsberger, previously known as Lisa Larsen Weidenbach, (born May 7, 1961) is a distance runner. As of 2014, she is the last American woman to have won the Boston Marathon. She is a member of the University of Michigan Track and Field and Road Runners of America Halls of Fame. Her marathon times were among the top ten in 1984 and 1987-1994. As of 2008, she was listed four times in the top 100 all-time US women's marathon performances, with a best time of 2:28:15.",1961,1985,24
Michael Spring,United States,Male Winner,Boston 1904,http://en.wikipedia.org/wiki/Michael_Spring,,"Michael ""Mike"" Spring (December 14, 1879 - March 17, 1970) was an Americantrack and field athlete.",1879,1904,25
Arthur Roth,United States,Male Winner,Boston 1916,http://en.wikipedia.org/wiki/Arthur_Roth,,"Arthur Vincent Roth (December 4, 1891 – October 10, 1950)[nb 1] was an American long-distance runner who won the 1916 Boston Marathon and competed in the men's marathon at the 1920 Summer Olympics.",1891,1916,25
Jacqueline Hansen,United States,Female Winner,Boston 1973,http://en.wikipedia.org/wiki/Jacqueline_Hansen,,"Jacqueline (""Jacki"") Hansen (born November 20, 1948) is a former long-distance runner from the United States who is recognized by the International Association of Athletics Federations as having set a world best in the marathon on two different occasions.1st 35-39 Div.5000m-17:43.10",1948,1973,25
