Uta Pippig,Germany,Female Winner,"Berlin 1992, Berlin 1995, Berlin 1990, Boston 1994, Boston 1995, Boston 1996, New York City 1993",http://en.wikipedia.org/wiki/Uta_Pippig,//upload.wikimedia.org/wikipedia/commons/thumb/2/27/Bundesarchiv_Bild_183-1986-0622-016%2C_Uta_Pippig.jpg/250px-Bundesarchiv_Bild_183-1986-0622-016%2C_Uta_Pippig.jpg,"Uta Pippig (born 7 September 1965 in Leipzig) is a female long-distancerunner, and the first woman to officially win the Boston Marathon three consecutive times (1994–1996). She also won the Berlin Marathon three times (1990, 1992 and 1995), the New York City Marathon once (1993), and she represented Germany in the 1992 and 1996 Olympics. Her best times include 15:03 for 5000 meters, 31:21 for 10,000 meters, 67:58 for the half marathon and 2:21:45 for the marathon. Pippig obtained American citizenship in 2004, and now holds an American passport. In 2004, Pippig founded ""Take The Magic Step"" to provide health information and charitable support to individuals and to organizations that promote wellness and education. In 2005, she was named to the Board of Advisors of the MIT AgeLab.",1965,1990,25
Katrin Dörre-Heinig,Germany,Female Winner,"Berlin 1994, London 1992, London 1994, London 1993",http://en.wikipedia.org/wiki/Katrin_D%C3%B6rre-Heinig,,"Katrin Dörre-Heinig (née Dörre, born 6 October 1961 in Leipzig, Sachsen) is a former athlete from Germany, who competed mainly in the marathon. She won extensively on the road running circuit, having taken titles at races including the Tokyo Marathon, Berlin Marathon and the London Marathon; she won three times consecutively in London from 1992–1994.",1961,1992,31
Irina Mikitenko,Germany,Female Winner,"Berlin 2008, London 2008, London 2009",http://en.wikipedia.org/wiki/Irina_Mikitenko,//upload.wikimedia.org/wikipedia/commons/thumb/a/a5/Irina_Mikitenko.jpg/220px-Irina_Mikitenko.jpg,"Irina Mikitenko, néeVolynskaya (Russian: Ирина Волынская (Микитенко); born 23 August 1972 in Bakanas, Kazakh SSR, Soviet Union), is a Kazakhstan-born Germanlong-distance runner who competes in marathons. She won the Berlin Marathon in 2008 and is a two-time winner of the London Marathon. She has competed at the Summer Olympics on four occasions.",1972,2008,36
Claudia Dreher,Germany,Female Winner,Tokyo 2008,http://en.wikipedia.org/wiki/Claudia_Dreher,,"Claudia Dreher (born 2 May 1971 in Magdeburg) is a female long-distance runner from Germany. She competed for her native country at the 2000 Summer Olympics in Sydney, Australia.",1971,2008,37
Stylianos Kyriakides,Greece,Male Winner,Boston 1946,http://en.wikipedia.org/wiki/Stylianos_Kyriakides,//upload.wikimedia.org/wikipedia/commons/thumb/5/5b/Kyriakides.jpg/220px-Kyriakides.jpg,"Stylianos ""Stelios"" Kyriakides (Greek: Στυλιανός ""Στέλιος"" Κυριακίδης; January 15, 1910 (unknown OS/NS) – December 1987) was a marathon runner.",1910,1946,36
Doroteo Flores,Guatemala,Male Winner,Boston 1952,http://en.wikipedia.org/wiki/Mateo_Flores,,"Mateo Flores, born Doroteo Guamuch Flores (February 11, 1922 – August 11, 2011), was a Guatemalanlong-distance runner who won several international events, including the Boston Marathon in 1952.",1922,1952,30
Ágnes Sipka,Hungary,Female Winner,Berlin 1984,http://en.wikipedia.org/wiki/%C3%81gnes_Sipka,,"Ágnes Sipka (born August 14, 1954) is a retired long-distance runner from Hungary, who won the 1984 edition of the Berlin Marathon on September 30, 1984, clocking 2:39:32.",1954,1984,30
Neil Cusack,Ireland,Male Winner,Boston 1974,http://en.wikipedia.org/wiki/Neil_Cusack,,Neil Cusack (born 30 December 1951 in Limerick) is a retired middle and long distance runner from Ireland.,1951,1974,23
Catherina McKiernan,Ireland,Female Winner,"Berlin 1997, London 1998",http://en.wikipedia.org/wiki/Catherina_McKiernan,,"Catherina McKiernan (born 30 November 1969 in Cornafean, County Cavan) is a former long-distance runner from Ireland, who competed in the marathon, 10,000 metres and cross country.",1969,1997,28
Giacomo Leone,Italy,Male Winner,New York City 1996,http://en.wikipedia.org/wiki/Giacomo_Leone,,"Giacomo Leone (born April 10, 1971 in Francavilla Fontana, Brindisi) is a retired male long-distance runner from Italy. He set his personal best (2:07:52) in the marathon on March 4, 2001 in Otsu, Japan. Leone is best known for winning the 1996 edition of the New York City Marathon.",1971,1996,25
Orlando Pizzolato,Italy,Male Winner,"New York City 1985, New York City 1984",http://en.wikipedia.org/wiki/Orlando_Pizzolato,//upload.wikimedia.org/wikipedia/commons/thumb/5/5d/Orlando_pizzolato.jpg/220px-Orlando_pizzolato.jpg,"Orlando Pizzolato (born July 30, 1958) is a retired long-distance runner from Italy.",1958,1984,26
Gelindo Bordin,Italy,Male Winner,Boston 1990,http://en.wikipedia.org/wiki/Gelindo_Bordin,//upload.wikimedia.org/wikipedia/commons/thumb/a/ae/GelindoBordin.jpg/220px-GelindoBordin.jpg,"Gelindo Bordin (born 2 April 1959) is an Italian former athlete, winner of the marathon race at the 1988 Summer Olympics. He is the only male to win both the Boston Marathon and an Olympic gold medal in the marathon.",1959,1990,31
Franca Fiacconi,Italy,Female Winner,New York City 1998,http://en.wikipedia.org/wiki/Franca_Fiacconi,,Franca Fiacconi (born 4 October 1965 in Rome) is a marathon runner from Italy.,1965,1998,33
Gianni Poli,Italy,Male Winner,New York City 1986,,,,,,
Hitomi Niiya,Japan,Female Winner,Tokyo 2007,http://en.wikipedia.org/wiki/Hitomi_Niiya,//upload.wikimedia.org/wikipedia/commons/thumb/8/8c/Women%27s_10%2C000_metres_2.jpg/220px-Women%27s_10%2C000_metres_2.jpg,"Hitomi Niiya(新谷 仁美,Niiya Hitomi?, born 26 February 1988 in Sōja, Okayama) is a Japanese long-distance runner who competes in cross country running and marathon races. Niiya competed for Japan at the 2012 Summer Olympics. She represents Team Toyota Industries in national competition.",1988,2007,19
Shigeki Tanaka,Japan,Male Winner,Boston 1951,http://en.wikipedia.org/wiki/Shigeki_Tanaka,,"Shigeki Tanaka(田中 茂樹,Tanaka Shigeki?, born April 7, 1931) is a retired long-distance runner from Japan, and the winner of the 1951 Boston Marathon.",1931,1951,20
Morio Shigematsu,Japan,Male Winner,Boston 1965,http://en.wikipedia.org/wiki/Morio_Shigematsu,,"Morio Shigematsu(重松 森雄,Shigematsu Morio?, born 1940) is a former Japaneselong-distance runner.",1940,1965,25
Kenji Kimihara,Japan,Male Winner,Boston 1966,http://en.wikipedia.org/wiki/Kenji_Kimihara,,"Kenji Kimihara(君原 健二,Kimihara Kenji?, born 20 March 1941 in Kitakyūshū) is a former Japaneselong-distance runner. He won the silver medal in the men's marathon at the 1968 Summer Olympics held in Mexico City, Mexico. Four years later he finished in fifth place in the same event. He won two gold medals in the marathon at the Asian Games in 1966 and 1970, and won the Boston Marathon in 1966.",1941,1966,25
Yoshiaki Unetani,Japan,Male Winner,Boston 1969,http://en.wikipedia.org/wiki/Yoshiaki_Unetani,,"Yoshiaki Unetani(采谷 義秋?, born October 6, 1944 in Hiroshima, Japan) is a Japanese former long-distance runner. Unusually for an elite athlete, he combined training with his job as a high school teacher. He has a personal best for the marathon of 2.12:12 which he set in at the Fukuoka Marathon in 1970. He competed in the marathon at the 1972 Summer Olympics in Munich, placing 36th. He secured his place at Munich by finishing third in the Lake Biwa Marathon, a race he had won the previous year. He won the 1969 Boston Marathon in a time of 2.13:49.",1944,1969,25
Toshihiko Seko,Japan,Male Winner,"Boston 1981, London 1986, Chicago 1986, Boston 1987",http://en.wikipedia.org/wiki/Toshihiko_Seko,,"Toshihiko Seko (瀬古利彦, Seko Toshihiko, born July 14, 1956 in Kuwana, Mie) is a Japanese long-distance runner, a world-class marathon competitor in the 1980s. He represented his native country at the 1984 and the 1988 Summer Olympics in Seoul, South Korea.",1956,1981,25
Yoko Shibui,Japan,Female Winner,Berlin 2004,http://en.wikipedia.org/wiki/Yoko_Shibui,//upload.wikimedia.org/wikipedia/commons/thumb/9/9a/Yoko_Shibui_during_2013_London_Marathon_%282%29.JPG/220px-Yoko_Shibui_during_2013_London_Marathon_%282%29.JPG,"Yoko Shibui(渋井 陽子,Shibui Yōko?, born March 14, 1979 in Kuroiso, now Nasushiobara, Tochigi) is a long-distance runner from Japan, who is competing in the 5000 and 10,000 metres as well as the marathon race. She holds the Japanese record over 10,000 m with her best time of 30:48.89 minutes. Shibui is one of only a handful of women to have completed the marathon under two hours and twenty minutes – her personal best of 2:19.41 ranks her within the top ten fastest ever.",1979,2004,25
Keizo Yamada,Japan,Male Winner,Boston 1953,http://en.wikipedia.org/wiki/Keizo_Yamada,,"Keizo Yamada(山田 敬蔵,Yamada Keizō?, born November 30, 1927 in Akita) is a retired long-distance runner from Japan, who won the 1956 edition of the Fukuoka Marathon, clocking 2:25:15 on December 9, 1956. He represented his native country at the 1952 Summer Olympics, finishing in 26th place (2:38:11) and won the 1953 Boston Marathon. He retired on July 18, 2009.",1927,1953,26
Kazumi Matsuo,Japan,Female Winner,Berlin 2000,http://en.wikipedia.org/wiki/Kazumi_Matsuo,,"Kazumi Matsuo (Japanese: 松尾和美; born April 16, 1974 in Kobe) is a female marathon runner from Japan, who won the Nagoya Marathon on March 11, 2001 in a personal best time of 2:26:01 hours after having triumped in the Berlin Marathon seven months earlier. She finished ninth at the 2001 World Championships in Athletics.",1974,2000,26
Hiromi Taniguchi,Japan,Male Winner,London 1987,http://en.wikipedia.org/wiki/Hiromi_Taniguchi,,"Hiromi Taniguchi(谷口 浩美,Taniguchi Hiromi?, born April 5, 1960) is a former Japaneselong-distance runner, best known from winning the gold medal in the marathon at the 1991 World Championships in Athletics in Tokyo. The favourite to win the race, Olympic champion Gelindo Bordin, only finished eighth. The marathon was run under extremely adverse conditions of heat and humidity, which are reflected in the slow winning time of 2:14:57h. Taniguchi is the only male Japanese runner ever to have won a gold medal at World Championships.",1960,1987,27
Mizuki Noguchi,Japan,Female Winner,Berlin 2005,http://en.wikipedia.org/wiki/Mizuki_Noguchi,,"Mizuki Noguchi(野口 みずき,Noguchi Mizuki?, born July 3, 1978) is a Japanese professional long-distance runner who specialises in the marathon event. She is an Olympic champion over the distance.",1978,2005,27
Yasuko Hashimoto,Japan,Female Winner,Berlin 2003,http://en.wikipedia.org/wiki/Yasuko_Hashimoto,,"Yasuko Hashimoto (born August 12, 1975) is a Japaneselong-distance runner, whose main event is the marathon. She won the 2007 edition of the Nagoya Marathon, clocking 2:28:49. Her personal best (2:25:21) was set in 2005. Other wins in her career include the Berlin Marathon in 2003 and consecutive wins at the Kagawa Marugame Half Marathon in 2003 and 2004.",1975,2003,28
Naoko Takahashi,Japan,Female Winner,"Berlin 2001, Berlin 2002",http://en.wikipedia.org/wiki/Naoko_Takahashi,//upload.wikimedia.org/wikipedia/commons/thumb/9/98/Takahashi_Naoko_Nagoya_Womens_Marathon_2008.jpg/150px-Takahashi_Naoko_Nagoya_Womens_Marathon_2008.jpg,"Naoko Takahashi(高橋 尚子,Takahashi Naoko?, born May 6, 1972 in Gifu, Japan) is a Japaneselong-distance runner competing mainly in the marathon.",1972,2001,29
Masakazu Fujiwara,Japan,Male Winner,Tokyo 2010,http://en.wikipedia.org/wiki/Masakazu_Fujiwara,//upload.wikimedia.org/wikipedia/commons/thumb/3/31/Berlin_marathon_2012_buelowstrasse_between_kilometers_36_and_37_30.09.2012_10-57-47.jpg/220px-Berlin_marathon_2012_buelowstrasse_between_kilometers_36_and_37_30.09.2012_10-57-47.jpg,"Masakazu Fujiwara (born 6 March 1981 in Ōkawachi, Hyōgo), in Japanese 藤原正和, is Japaneselong-distance runner, who specializes in the marathon. He has a personal best of 2:08:12 hours for the event. He was the 2013 Japanese champion in the marathon and won the 2010 Tokyo Marathon. He trains at Honda Sports team.",1981,2010,29
Mizuho Nasukawa,Japan,Female Winner,Tokyo 2009,,,,,,
Noriko Higuchi,Japan,Female Winner,Tokyo 2011,,,,,,
Hideo Hamamura,Japan,Male Winner,Boston 1955,,,,,,
Tegla Loroupe,Kenya,Female Winner,"London 2000, Berlin 1999, New York City 1994, New York City 1995",http://en.wikipedia.org/wiki/Tegla_Loroupe,//upload.wikimedia.org/wikipedia/commons/thumb/7/77/Loroupe%2C_Tegla.JPG/220px-Loroupe%2C_Tegla.JPG,"Tegla Chepkite Loroupe (born 9 May 1973 in Kutomwony, Kenya) is a Kenyan long-distance track and road runner. She is also a global spokeswoman for peace, women's rights and education.",1973,1994,21
Cosmas Ndeti,Kenya,Male Winner,"Boston 1993, Boston 1994, Boston 1995",http://en.wikipedia.org/wiki/Cosmas_Ndeti,//upload.wikimedia.org/wikipedia/commons/thumb/4/49/Flag_of_Kenya.svg/30px-Flag_of_Kenya.svg.png,"Cosmas Ndeti (born November 24, 1971) is a three-time winner of the Boston Marathon. He was the winner of the 1993, 1994, and 1995 races. He set the course record in 1994 with a time of 2:07:15, which was also the best marathon performance in 1994. That course record stood for 12 years until it was broken by one second when Robert Kipkoech Cheruiyot, a fellow Kenyan, won the 2006 race.",1971,1993,22
Robert Kiprono Cheruiyot,Kenya,Male Winner,Boston 2010,http://en.wikipedia.org/wiki/Robert_Kiprono_Cheruiyot,//upload.wikimedia.org/wikipedia/commons/thumb/d/d0/Robert_kiprono_cheruiyot.jpg/220px-Robert_kiprono_cheruiyot.jpg,"Robert Kiprono Cheruiyot (born August 10, 1988) is a Kenyanmarathonrunner. He is known as a ""true marathoner"" who rarely races other distances. He finished fifth or better in the first four international marathons he has entered.",1988,2010,22
Samuel Wanjiru,Kenya,Male Winner,"London 2009, Chicago 2010, Chicago 2009",http://en.wikipedia.org/wiki/Samuel_Wanjiru,//upload.wikimedia.org/wikipedia/commons/thumb/1/16/Samuel_Wanjiru2008_Summer_Olympics2.jpg/200px-Samuel_Wanjiru2008_Summer_Olympics2.jpg,"Samuel Kamau Wanjiru (10 November 1986 – 15 May 2011) was a Kenyanathlete who specialised in long distance running. He became a professional at a young age and broke the world record in the half marathon when he was 18 years old. In 2007, he broke the 20 km road running record and improved the half marathon record by over twenty seconds.",1986,2009,23
Felix Limo,Kenya,Male Winner,"Chicago 2005, London 2006, Berlin 2004",http://en.wikipedia.org/wiki/Felix_Limo,//upload.wikimedia.org/wikipedia/commons/thumb/5/5d/20060423_Felix_Limo_and_Martin_Lel.jpg/148px-20060423_Felix_Limo_and_Martin_Lel.jpg,"Felix Limo (born August 22, 1980) is a Kenyan former long-distance runner, who specialized in the marathon.",1980,2004,24
Florence Kiplagat,Kenya,Female Winner,"Berlin 2011, Berlin 2013",http://en.wikipedia.org/wiki/Florence_Kiplagat,//upload.wikimedia.org/wikipedia/commons/thumb/b/bb/Florence_Jebet_Kiplagat_winning_the_Berlin_Marathon_2011.jpg/250px-Florence_Jebet_Kiplagat_winning_the_Berlin_Marathon_2011.jpg,"Florence Jebet Kiplagat (born 27 February 1987) is a Kenyanlong-distance runner. She is a two-time world champion, having won at the 2009 IAAF World Cross Country Championships and the 2010 IAAF World Half Marathon Championships. She is the current world record holder for the women's half marathon with her time of 1:05:12 hours.",1987,2011,24
Margaret Okayo,Kenya,Female Winner,"Boston 2002, London 2004, New York City 2003, New York City 2001",http://en.wikipedia.org/wiki/Margaret_Okayo,//upload.wikimedia.org/wikipedia/commons/thumb/9/94/Margaret_Okayo_London_2005.jpg/220px-Margaret_Okayo_London_2005.jpg,"Margaret Okayo (born May 30, 1976 in Masaba, Kisii District) is a professional marathonrunner from Kenya. She has won a number of major marathons, including the New York City Marathon (three times), the Boston Marathon, and the London Marathon. She has also won the San Diego Marathon on two occasions.",1976,2001,25
Martin Lel,Kenya,Male Winner,"London 2008, New York City 2003, London 2005, New York City 2007, London 2007",http://en.wikipedia.org/wiki/Martin_Lel,//upload.wikimedia.org/wikipedia/commons/thumb/5/5d/20060423_Felix_Limo_and_Martin_Lel.jpg/220px-20060423_Felix_Limo_and_Martin_Lel.jpg,"Martin Kiptolo Lel (born 29 October 1978 in Kapsabet) is a Kenyanlong distance and marathon runner. He won the London Marathon in 2005, 2007, and 2008, the New York City Marathon in 2003 and 2007 and the Great North Run in 2007 and 2009. His personal best time, as of April 2008, is 2:05:15, which he ran in the 2008 London Marathon setting a course record. Lel is coached by Claudio Berardelli and lives in the Rift Valley region of Kenya.",1978,2003,25
Robert Kipkoech Cheruiyot,Kenya,Male Winner,"Chicago 2006, Boston 2008, Boston 2007, Boston 2006, Boston 2003",http://en.wikipedia.org/wiki/Robert_Kipkoech_Cheruiyot,//upload.wikimedia.org/wikipedia/commons/thumb/6/62/Cheruiyot.jpg/220px-Cheruiyot.jpg,"Robert ""Mwafrika"" Kipkoech Cheruiyot (born September 26, 1978 in Kapsabet, Kenya), sometimes known as Omar Ahmed, is a Kenyanmarathonrunner and is the former record holder and four-time winner of the Boston Marathon.",1978,2003,25
Evans Rutto,Kenya,Male Winner,"Chicago 2004, London 2004, Chicago 2003",http://en.wikipedia.org/wiki/Evans_Rutto,//upload.wikimedia.org/wikipedia/commons/thumb/e/ec/2005_London_Marathon_Lel-Rutto-Gharib.jpg/220px-2005_London_Marathon_Lel-Rutto-Gharib.jpg,"Evans Rutto (born April 8, 1978 in Marakwet District) is a Kenyanlong-distance runner, who specialises in road running events. He made the fastest ever debut marathon by winning the 2003 Chicago Marathon in a time of 2:05:50. He won the London Marathon and a second title in Chicago the following year.",1978,2003,25
Rita Jeptoo,Kenya,Female Winner,"Boston 2013, Boston 2014, Boston 2006, Chicago 2013",http://en.wikipedia.org/wiki/Rita_Jeptoo,//upload.wikimedia.org/wikipedia/commons/thumb/b/b2/Rita_Jeptoo_at_the_2007_Boston_Marathon.jpg/170px-Rita_Jeptoo_at_the_2007_Boston_Marathon.jpg,"Rita Jeptoo (born 15 February 1981) is a Kenyanmarathon runner. She has won the Boston Marathon three times, including setting the course record at 2:18:57 in 2014. She has also won marathons in Chicago, Stockholm, and Milan, as well as having represented Kenya in the event at the 2007 World Championships in Athletics. She was the bronze medalist at the 2006 IAAF World Road Running Championships.",1981,2006,25
Patrick Makau Musyoki,Kenya,Male Winner,"Berlin 2010, Berlin 2011",http://en.wikipedia.org/wiki/Patrick_Makau_Musyoki,//upload.wikimedia.org/wikipedia/commons/thumb/4/4b/Patrick_Makau_at_the_Berlin_Marathon_2011.jpg/220px-Patrick_Makau_at_the_Berlin_Marathon_2011.jpg,"Patrick Makau Musyoki (born 2 March 1985 in Manyanzwani, Eastern Province) is a runner from Kenya. He is the former world record holder in the marathon with a time of 2:03:38, set at the 2011 Berlin Marathon. He is also notable for his half marathon performances, having won a number of prominent competitions in Europe in sub-1-hour performances.",1985,2010,25
Douglas Wakiihuri,Kenya,Male Winner,"London 1989, New York City 1990",http://en.wikipedia.org/wiki/Douglas_Wakiihuri,//upload.wikimedia.org/wikipedia/commons/thumb/3/3f/Douglas_Wakiihuri%2C_Samuel_Wanjiru_and_Raila_Odinga.jpg/220px-Douglas_Wakiihuri%2C_Samuel_Wanjiru_and_Raila_Odinga.jpg,"Douglas Wakiihuri (born September 26, 1963 in Mombasa) is a former Kenyanlong-distancerunner, who won the gold medal in the marathon at the 1987 World Championships in Athletics in Rome.",1963,1989,26
Lameck Aguta,Kenya,Male Winner,Boston 1997,http://en.wikipedia.org/wiki/Lameck_Aguta,,"Lameck Aguta (born October 10, 1971) is a former Kenyan marathon runner. He was the winner of the 101st Boston Marathon in 1997 with a time of 2:10:34 hours.",1971,1997,26
Josephat Kiprono,Kenya,Male Winner,Berlin 1999,http://en.wikipedia.org/wiki/Josephat_Kiprono,,"Josephat Kiprono (born December 12, 1973) is a Kenyan distance and marathon runner. He participated at the IAAF World Half Marathon Championships in 1996 and won a silver medal finishing behind Italian Stefano Baldini. Kiprono won three marathons in his career: Berlin (1999), Rome (2000), and Rotterdam (2001). His Rotterdam time of 2.06:50 hours which was the best marathon performance in 2001. His personal best in the classic distance is 2:06:44, ran in Berlin.",1973,1999,26
Rodgers Rop,Kenya,Male Winner,"New York City 2002, Boston 2002",http://en.wikipedia.org/wiki/Rodgers_Rop,//upload.wikimedia.org/wikipedia/commons/thumb/9/94/Rodgers_Rop.jpg/220px-Rodgers_Rop.jpg,Rodgers Rop (born 16 February 1976) is a long-distance runner from Kenya.,1976,2002,26
Evans Cheruiyot,Kenya,Male Winner,Chicago 2008,http://en.wikipedia.org/wiki/Evans_Cheruiyot,//upload.wikimedia.org/wikipedia/commons/thumb/5/5d/20081012_Evans_Cheruiyot.jpg/220px-20081012_Evans_Cheruiyot.jpg,"Evans Kiprop Cheruiyot (born 10 May 1982, Kapkoi village, Keiyo District) is a Kenyan long-distance runner who competes in the marathon. He started out as a half marathon runner, taking wins in Rotterdam and Nairobi, and won his debut marathon race in Milan in 2007. He won the Chicago Marathon in 2008, running a personal best of 2:06:25 hours.",1982,2008,26
Moses Mosop,Kenya,Male Winner,Chicago 2011,http://en.wikipedia.org/wiki/Moses_Mosop,//upload.wikimedia.org/wikipedia/commons/thumb/2/20/Prague_International_Marathon_in_2014_%28114%29.JPG/220px-Prague_International_Marathon_in_2014_%28114%29.JPG,"Moses Cheruiyot Mosop (born 1985-07-07) in Kamasia, Marakwet District) is a Kenyanmiddle and long distanceathlete. He competed for Kenya at the 2004 Olympic Games and went on to take 10,000 metres bronze at the 2005 World Championships in Athletics. He has also been successful in cross country running, having won the silver at the 2007 IAAF World Cross Country Championships as well as team gold with Kenya in 2007 and 2009.",1985,2011,26
Joyce Chepchumba,Kenya,Female Winner,"Chicago 1999, Chicago 1998, London 1999, London 1997, New York City 2002",http://en.wikipedia.org/wiki/Joyce_Chepchumba,//upload.wikimedia.org/wikipedia/commons/thumb/9/95/Chepchumba%2C_Joyce.jpg/150px-Chepchumba%2C_Joyce.jpg,Joyce Chepchumba (born 6 November 1970 in Kericho) is a long distanceathlete from Kenya.,1970,1997,27
Emmanuel Mutai,Kenya,Male Winner,London 2011,http://en.wikipedia.org/wiki/Emmanuel_Mutai,//upload.wikimedia.org/wikipedia/commons/thumb/b/ba/Emmanuel_Mutai_during_2013_London_Marathon_%283%29.JPG/180px-Emmanuel_Mutai_during_2013_London_Marathon_%283%29.JPG,"Emmanuel Kipchirchir Mutai (born October 12, 1984) is a long distance runner from Kenya, who specialises in marathons. He is the second fastest man ever over the 42.195 km distance.",1984,2011,27
Catherine Ndereba,Kenya,Female Winner,"Boston 2000, Boston 2005, Boston 2001, Boston 2004, Chicago 2001, Chicago 2000",http://en.wikipedia.org/wiki/Catherine_Ndereba,//upload.wikimedia.org/wikipedia/commons/thumb/7/73/Osaka07_D9M_WMarathon_Ndereba_running.jpg/200px-Osaka07_D9M_WMarathon_Ndereba_running.jpg,"Catherine Nyambura Ndereba (born 21 July 1972) is a Kenyanmarathon runner. She has twice won the marathon at the World Championships in Athletics and won silver medals in the Olympics in 2004 and 2008. She is also a four-time winner of the Boston Marathon. Ndereba broke the women's marathon world record in 2001, running 2:18:47 at the Chicago Marathon.",1972,2000,28
Timothy Cherigat,Kenya,Male Winner,Boston 2004,http://en.wikipedia.org/wiki/Timothy_Cherigat,//upload.wikimedia.org/wikipedia/commons/thumb/5/57/Boston25m-0002.jpg/220px-Boston25m-0002.jpg,"Timothy Cherigat (born December 29, 1976 in Chepkorio) is a long-distance runner from Kenya, who was the winner of the 108th Boston Marathon held in 2004. Cherigat won this race in a time of 2:10:37 on an abnormally warm day during which temperatures reached as high as 87 °F (30 °C).",1976,2004,28
Sharon Cherop,Kenya,Female Winner,Boston 2012,http://en.wikipedia.org/wiki/Sharon_Cherop,//upload.wikimedia.org/wikipedia/commons/thumb/e/e7/Sharon_Cherop_winner_of_2012_Boston_Marathon.jpg/180px-Sharon_Cherop_winner_of_2012_Boston_Marathon.jpg,Sharon Jemutai Cherop (born 16 March 1984) is a Kenyanlong-distance runner who specialises in the marathon. She won a bronze medal at the age of sixteen in the 5000 metres at the World Junior Championships. She was the bronze medal winner in the marathon at the 2011 World Championships in Athletics and won the Boston Marathon in 2012.,1984,2012,28
Dickson Chumba,Kenya,Male Winner,Tokyo 2014,http://en.wikipedia.org/wiki/Dickson_Chumba,,"Dickson Kiptolo Chumba (born 27 October 1986) is a Kenyanlong-distance runner who competes in marathon races. He has won the Rome, Eindhoven, and Tokyo marathons and has a personal best of 2:05:42 for the distance.",1986,2014,28
Ibrahim Hussein,Kenya,Male Winner,"Boston 1992, New York City 1987, Boston 1988, Boston 1991",http://en.wikipedia.org/wiki/Ibrahim_Hussein_(runner),,"Ibrahim Kipkemboi Hussein (born June 3, 1958 in Kapsabet, Rift Valley) is a retired long-distance runner from Kenya, who was a three-time winner of the Boston Marathon in 1988, 1991, and 1992. He was also the winner of the New York City Marathon in 1987, and multiple other marathons in his years. Ibrahim Hussein was later signed to run for Adidas after completing college at the University of New Mexico. He and his wife Zainab Ibrahim are both alumni at the University of New Mexico in Albuquerque, NM. Ibrahim Hussein is among many athletes on the hall of fame in New Mexico. The couple have five children, Hussein Ibrahim, Farida Ibrahim, Hadija Ibrahim, Jamal Ibrahim and Warda Ibrahim.",1958,1987,29
