Winner,Country,Category,Marathons,Wikipedia Page,Image,Description,Date of birth,Year of first major marathon win,Age of first major marathon victory
Steve Moneghetti,Australia,Male Winner,Berlin 1990,http://en.wikipedia.org/wiki/Steve_Moneghetti,//upload.wikimedia.org/wikipedia/commons/6/60/Steve_Moneghetti_%28cropped%29.jpg,"Stephen James ""Steve"" Moneghetti, AM (born 26 September 1962 in Ballarat, Victoria), is an Australian long-distance runner. Moneghetti has a degree in civil engineering, a graduate diploma in education and an honorary doctorate from the University of Ballarat. He is a personal development consultant with the Ministry of Education and chair of the Victorian Review into Physical and Sport Education in Schools.",1962,1990,28
Robert de Castella,Australia,Male Winner,Boston 1986,http://en.wikipedia.org/wiki/Robert_de_Castella,//upload.wikimedia.org/wikipedia/commons/thumb/4/47/Robert_de_Castella_1983.jpg/220px-Robert_de_Castella_1983.jpg,"Robert Francois ""Rob"" de CastellaAO, MBE (born 27 February 1957) is an Australian former world champion marathon runner.",1957,1986,29
Lisa Ondieki,Australia,Female Winner,New York City 1992,http://en.wikipedia.org/wiki/Lisa_Martin,,"Lisa Frances Ondieki (née O'Dea, formerly Martin) (born 12 May 1960 in Gawler, South Australia) is an Australian retired female long-distance runner.",1960,1992,32
Marleen Renders,Belgium,Female Winner,Berlin 1998,http://en.wikipedia.org/wiki/Marleen_Renders,,"Marleen Renders (born 24 December 1968, in Diest) is a retired female long-distance runner from Belgium, who represented her native country thrice at the Summer Olympics: in 1988, 1996 and 2000. In 1995 she won the Antwerp Marathon, in 1998 the Berlin Marathon, and she triumphed twice in the Paris Marathon in 2000 and 2002 (with a personal best of 2:23:05).",1968,1998,30
Aurèle Vandendriessche,Belgium,Male Winner,"Boston 1963, Boston 1964",http://en.wikipedia.org/wiki/Aur%C3%A8le_Vandendriessche,,"Aurèle Vandendriessche (born 4 July 1932 in Anzegem, West-Vlaanderen) is a retired marathonrunner from Belgium, who won the silver medal at the 1962 European Championships, behind Great Britains Brian Kilby.1970 to present",1932,1963,31
Karel Lismont,Belgium,Male Winner,Berlin 1983,http://en.wikipedia.org/wiki/Karel_Lismont,//upload.wikimedia.org/wikipedia/commons/thumb/d/db/Karel_Lismont_1976.jpg/220px-Karel_Lismont_1976.jpg,"Karel Lismont (born 8 March 1949) is a former Belgian long-distance runner. He competed at the 1972, 1976, 1980 and 1984 Olympics in the marathon and 10,000 m events. He won two marathon medals: a silver in 1972 and a bronze in 1976, finishing ninth and twenty-fourth in 1980 and 1984, respectively; he was less successful in the 10,000 m, finishing eleventh in 1976 and failing to reach the final in 1972.",1949,1983,34
Magda Ilands,Belgium,Female Winner,Berlin 1985,http://en.wikipedia.org/wiki/Magda_Ilands,,"Magda Ilands (born 16 January 1950, in Leuven, Vlaams-Brabant) is a former female long-distance runner from Belgium, who represented her native country at the 1988 Summer Olympics. She won the 1985 edition of the Berlin Marathon.",1950,1985,35
Ronaldo da Costa,Brazil,Male Winner,Berlin 1998,http://en.wikipedia.org/wiki/Ronaldo_da_Costa,,"Ronaldo da Costa (born June 7, 1970 in Descoberto, Brazil) broke the ten-year-old marathonworld record in 1998 in Berlin. The record was previously held by Belayneh Densamo from Ethiopia at the Rotterdam Marathon in April, 1988.",1970,1998,28
Luíz Antônio dos Santos,Brazil,Male Winner,"Chicago 1994, Chicago 1993",http://en.wikipedia.org/wiki/Lu%C3%ADz_Ant%C3%B4nio_dos_Santos,,"Luíz Antônio dos Santos (born April 6, 1964 in Volta Redonda, Rio de Janeiro) is a retired long-distance runner from Brazil, who won the 1995 edition of the Fukuoka Marathon, clocking 2:09:30 on December 3, 1995. Earlier that year he claimed the bronze medal at the 1995 World Championships. He represented his native country in the men's marathon at the 1996 Summer Olympics, finishing in tenth place. He won the Chicago Marathon in both 1993 and 1994.",1964,1993,29
Marílson Gomes dos Santos,Brazil,Male Winner,"New York City 2006, New York City 2008",http://en.wikipedia.org/wiki/Mar%C3%ADlson_Gomes_dos_Santos,//upload.wikimedia.org/wikipedia/commons/thumb/6/63/Marilson_dos_Santos_%28Brazil%29_-_London_2012_Mens_Marathon.jpg/175px-Marilson_dos_Santos_%28Brazil%29_-_London_2012_Mens_Marathon.jpg,"Marílson Gomes dos Santos (born 6 August 1977 in Brasília, DF) is a Brazilianlong-distance runner and winner of the 2006 and 2008 New York City Marathon, with times of 2:09:58 and 2:08:43, respectively. He is the first South American to win the race.",1977,2006,29
José Cesar de Souza,Brazil,Male Winner,Chicago 1992,,,,,,
Joseildo Rocha,Brazil,Male Winner,Chicago 1991,,,,,,
Thomas Longboat,Canada,Male Winner,Boston 1907,http://en.wikipedia.org/wiki/Tom_Longboat,//upload.wikimedia.org/wikipedia/commons/thumb/1/1e/T_Longboat%2C_the_Canadian_runner_Standing_%28HS85-10-18314%29.jpg/250px-T_Longboat%2C_the_Canadian_runner_Standing_%28HS85-10-18314%29.jpg,"Cogwagee (Thomas Charles Longboat) (June 4, 1887 – January 9, 1949) was an Onondaga distance runner from the Six Nations of the Grand River First NationIndian reserve near Brantford, Ontario, and for much of his career the dominant long distance runner of the time. When he was a child, a Mohawk resident of the reserve, Bill Davis, who in 1901 finished second in the Boston Marathon, interested him in running races.",1887,1907,20
"John ""Jack"" Caffery",Canada,Male Winner,"Boston 1900, Boston 1901",http://en.wikipedia.org/wiki/Jack_Caffery,//upload.wikimedia.org/wikipedia/commons/d/d5/Caffrey.jpg,"John (""Jack"") Peter Caffery (May 21, 1879 – February 2, 1919) was a Canadiantrack and field athlete who competed in the marathon at the 1908 Summer Olympics where he finished in 11th place. Caffrey was also a two-time champion of the Boston Marathon. He won with a time of 2:39:44.4 in 1900 and with a time of 2:29:23.6 in 1901, both of which were course records for the then 25-mile course.",1879,1900,21
Johnny Miles,Canada,Male Winner,"Boston 1926, Boston 1929",http://en.wikipedia.org/wiki/Johnny_Miles,//upload.wikimedia.org/wikipedia/en/thumb/3/30/Johnny_Miles_winning_the_1926_Boston_Marathon.jpg/220px-Johnny_Miles_winning_the_1926_Boston_Marathon.jpg,"1925 Canadian 5-mile championJohn ""Johnny"" C. Miles, CM (October 30, 1905 – June 15, 2003) was a Canadianmarathon runner. He won the Boston Marathon in 1926 and 1929.",1905,1926,21
Ronald J. MacDonald,Canada,Male Winner,Boston 1898,http://en.wikipedia.org/wiki/Ronald_J._MacDonald,//upload.wikimedia.org/wikipedia/commons/thumb/7/7a/MacDonald-Evan_Nappen%2CEsq._Collection.jpg/220px-MacDonald-Evan_Nappen%2CEsq._Collection.jpg,"Ronald MacDonald (Ronald John MacDonald; March 30, 1874 - September 3, 1947) was a Canadian runner and winner of the second Boston Marathon in 1898.",1874,1898,24
James Duffy,Canada,Male Winner,Boston 1914,http://en.wikipedia.org/wiki/James_Duffy_(athlete),//upload.wikimedia.org/wikipedia/commons/thumb/e/e3/AroundtheBay.jpg/220px-AroundtheBay.jpg,"Jimmy McNiff/Duffy (born May 1, 1890, in County Sligo, Ireland – died April 23, 1915, outside Ypres, Belgium) was a distance runner from Canada, one of the world's best marathon runners at the beginning of the 20th century. He participated in the 1912 Summer Olympics in Stockholm and was the winner of the 1914 Boston Marathon.",1890,1914,24
Gérard Côté,Canada,Male Winner,"Boston 1940, Boston 1943, Boston 1944, Boston 1948",http://en.wikipedia.org/wiki/G%C3%A9rard_C%C3%B4t%C3%A9,//upload.wikimedia.org/wikipedia/commons/thumb/b/bc/Gerard_Cote_1940.jpg/260px-Gerard_Cote_1940.jpg,"Gérard Côté, CMCQ (July 27, 1913 – 13 June 1993) was a Canadianmarathonrunner and a four-time winner of the Boston Marathon.",1913,1940,27
Jacqueline Gareau,Canada,Female Winner,Boston 1980,http://en.wikipedia.org/wiki/Jacqueline_Gareau,,"Jacqueline Gareau (born March 10, 1953 in L'Annonciation, Quebec) is a Canadian runner who won the Boston Marathon on April 21, 1980. Gareau led the women's field for most of the race, only to find another runner, Rosie Ruiz, wearing the traditional victor's laurels when she crossed the finish line. Ruiz was later disqualified after it was determined she hadn't run the entire race, and Gareau was awarded the victory in a special ceremony one week later. Her official time for the 1980 marathon, 2:34:28, was the fastest time recorded for a woman in the event's history at the time.",1953,1980,27
Édouard Fabre,Canada,Male Winner,Boston 1915,http://en.wikipedia.org/wiki/%C3%89douard_Fabre,//upload.wikimedia.org/wikipedia/commons/thumb/d/d2/%C3%89douard_Fabre.jpg/220px-%C3%89douard_Fabre.jpg,"Édouard Fabre (August 21, 1885 – July 1, 1939) was a Canadianmarathonrunner.",1885,1915,30
Jerome Drayton,Canada,Male Winner,Boston 1977,http://en.wikipedia.org/wiki/Jerome_Drayton,,"Jerome Drayton (born January 10, 1945 in Kolbermoor, Bavaria, Germany) is a former long-distance runner who competed internationally for Canada. He was born as Peter Buniak in Germany, and came to Canada in the mid-1950s when his mother moved there after divorcing his father. He reportedly based his new name on two famous sprinters he admired: Canadian former world record holder Harry Jerome and American Paul Drayton, former world record holder in the 4x100m as part of the American relay team. A prominent runner in the 1970s, when he was for a time ranked as the top marathoner in the world, he won the Fukuoka Marathon in 1969, 1975, and 1976, as well as the Boston Marathon in 1977. He is the Canadian record holder in the marathon, with his best time of 2:10:08, set in 1975 at the Fukuoka Marathon; he has held the Canadian record since 1969, after breaking the then record of 2:18:55 set by Robert Moore a month earlier.",1945,1977,32
Dave Komonen,Canada,Male Winner,Boston 1934,http://en.wikipedia.org/wiki/Dave_Komonen,,"Taavi (Dave) Komonen (December 16, 1898 – April 19, 1978) was a Finnish-Canadian athlete, who mainly competed in marathon running. He won the Boston Marathon in 1934.",1898,1934,36
Fred Cameron,Canada,Male Winner,Boston 1910,,,,,,
Walter Young,Canada,Male Winner,Boston 1937,,,,,,
Zhou Chunxiu,China,Female Winner,London 2007,http://en.wikipedia.org/wiki/Zhou_Chunxiu,//upload.wikimedia.org/wikipedia/commons/thumb/a/ac/Osaka07_D9M_WMarathon_Zhou_running.jpg/210px-Osaka07_D9M_WMarathon_Zhou_running.jpg,"Zhou Chunxiu (Chinese: 周春秀; pinyin: Zhōu Chūnxiù; born November 15, 1978 in Jiangsu) is a Chinesemarathon runner.",1978,2007,29
Álvaro Mejía,Colombia,Male Winner,Boston 1971,http://en.wikipedia.org/wiki/%C3%81lvaro_Mej%C3%ADa_(athlete),,"Álvaro Mejía Florez (born May 15, 1940 in Medellín, Antioquia) is a former long-distance runner from Colombia, who became a national hero after competing in the 1964 Tokyo Olympic Games5,000 meter final.",1940,1971,31
Domingo Tibaduiza,Colombia,Male Winner,Berlin 1982,http://en.wikipedia.org/wiki/Domingo_Tibaduiza,//upload.wikimedia.org/wikipedia/commons/thumb/2/21/Flag_of_Colombia.svg/30px-Flag_of_Colombia.svg.png,"Domingo Tibaduiza Reyes (born November 22, 1950) is a former long-distance runner from Gameza, Colombia, who represented his native country at four consecutive Summer Olympics: in the 10,000 metres (1972, 1976, 1980 and 1984), the 5,000 metres (1976) and in the men's marathon (1980, 1984). He currently holds the Colombian national record for 5000 metres, 10000 metres and 20000 metres.",1950,1982,32
Henrik Jørgensen,Denmark,Male Winner,London 1988,http://en.wikipedia.org/wiki/Henrik_J%C3%B8rgensen_(athlete),,"Henrik Høve Jørgensen (born 10 October 1961 in Copenhagen, Hovedstaden) is a Danishmarathonrunner, who won the London Marathon in 1988. He finished 5th in 1985 in 2:09.43 hours – still the Danish national record and Scandinavian regional record. Jørgensen represented his native country in the men's marathon at the 1984 and the 1988 Summer Olympics in Seoul, South Korea. He is a two-time national champion in the men's 5000 m.",1961,1988,27
John Skovbjerg,Denmark,Male Winner,Berlin 1984,,,,,,
Aberu Kebede,Ethiopia,Female Winner,"Berlin 2012, Berlin 2010, Tokyo 2013",http://en.wikipedia.org/wiki/Aberu_Kebede,//upload.wikimedia.org/wikipedia/commons/thumb/d/d2/Berlin_marathon_2012_buelowstrasse_between_kilometers_36_and_37_30.09.2012_11-05-046.jpg/220px-Berlin_marathon_2012_buelowstrasse_between_kilometers_36_and_37_30.09.2012_11-05-046.jpg,"Aberu Kebede Shewaye (born 12 September 1989) is an Ethiopianlong distance runner who specialises in road running competitions. Her half marathon best of 1:07:39 is one of the fastest ever by an Ethiopian woman. She gained a bronze at the 2009 IAAF World Half Marathon Championships with the performance and has won at the Berlin Marathon, Stramilano Half Marathon and the Rotterdam Marathon. She has a marathon best of 2:20:30 hours.",1989,2010,21
Atsede Habtamu Besuye,Ethiopia,Female Winner,Berlin 2009,http://en.wikipedia.org/wiki/Atsede_Habtamu_Besuye,,Atsede Habtamu Besuye (born 26 October 1987) is an Ethiopianlong-distance runner who specialises in road running and the marathon distance.,1987,2009,22
Dire Tune,Ethiopia,Female Winner,Boston 2008,http://en.wikipedia.org/wiki/Dire_Tune,//upload.wikimedia.org/wikipedia/commons/thumb/5/52/Dire_tune.jpg/150px-Dire_tune.jpg,"Dire Tune Arissi (pronounced ""Deer-ay Too-nay"";Ge'ez: ዲሬ ቱኔ, born 19 June 1985) is an Ethiopianlong-distancerunner.",1985,2008,23
Tsegaye Kebede,Ethiopia,Male Winner,"Chicago 2012, London 2010, London 2013",http://en.wikipedia.org/wiki/Tsegaye_Kebede,//upload.wikimedia.org/wikipedia/commons/thumb/8/8a/Kebede2007.jpg/200px-Kebede2007.jpg,"Tsegaye Kebede Wordofa (Amharic: ፀጋየ ከበደ ዎርዶፋ; born 15 January 1987) is an Ethiopianlong-distance runner who competes in road running events, including marathons. He quickly rose to become a prominent distance runner after his international debut at the Amsterdam Marathon in 2007. In his second year of professional running, he won the Paris Marathon, the Fukuoka Marathon and won the marathon bronze medal at the 2008 Beijing Olympics.",1987,2010,23
Lelisa Desisa Benti,Ethiopia,Male Winner,Boston 2013,http://en.wikipedia.org/wiki/Lelisa_Desisa,//upload.wikimedia.org/wikipedia/commons/thumb/6/61/Lelisa_Desisa_Benti_boston_marathon_2013.jpg/180px-Lelisa_Desisa_Benti_boston_marathon_2013.jpg,"Lelisa Desisa Benti (born 14 January 1990) is an Ethiopianlong-distance runner who specialises in road running competitions. He gained his first international medal at the 2009 African Junior Athletics Championships, where he took the 10,000 metresgold medal.",1990,2013,23
Fatuma Roba,Ethiopia,Female Winner,"Boston 1999, Boston 1997, Boston 1998",http://en.wikipedia.org/wiki/Fatuma_Roba,,"Fatuma Roba (born December 18, 1973) is an Ethiopianlong distancerunner from Addis Ababa, Ethiopia, most known for winning a gold medal in the women's marathon race at the 1996 Summer Olympics. She finished fourth at the 1999 World Championships in Athletics.",1973,1997,24
Abebe Mekonnen,Ethiopia,Male Winner,Boston 1989,http://en.wikipedia.org/wiki/Abebe_Mekonnen,//upload.wikimedia.org/wikipedia/commons/thumb/e/ee/Abebe_Mekonnen.jpg/200px-Abebe_Mekonnen.jpg,Abebe Mekonnen (born 16 October 1964) is an Ethiopianlong-distancerunner.,1964,1989,25
Tesfaye Jifar,Ethiopia,Male Winner,New York City 2001,http://en.wikipedia.org/wiki/Tesfaye_Jifar,,"Tesfaye Jifar (Amharic: ተስፋዬ ጅፋር) born April 23, 1976) is a male Ethiopianlong-distance runner.",1976,2001,25
Gezahegne Abera,Ethiopia,Male Winner,London 2003,http://en.wikipedia.org/wiki/Gezahegne_Abera,//upload.wikimedia.org/wikipedia/commons/thumb/7/79/GezahegneAberaInFrontOfMyCar.jpg/150px-GezahegneAberaInFrontOfMyCar.jpg,"Gezahegne Abera (Amharic: ገዛሄኘ አበራ; born April 23, 1978) is an Ethiopianathlete, winner of the marathon race at the 2000 Summer Olympics.",1978,2003,25
Atsede Baysa,Ethiopia,Female Winner,Chicago 2012,http://en.wikipedia.org/wiki/Atsede_Baysa,//upload.wikimedia.org/wikipedia/commons/thumb/2/2f/2012_Chicago_Marathon_-_Merima-Atsede-Fatuma.jpg/200px-2012_Chicago_Marathon_-_Merima-Atsede-Fatuma.jpg,"Atsede Baysa Tesema, also known as Atsede Bayisa, (born 16 April 1987) is an Ethiopianlong distance runner who specialises in road running events. She has won the Chicago Marathon and Paris Marathon twice consecutively. She has also won at the Xiamen International Marathon and the Istanbul Marathon.",1987,2012,25
Atsede Habtamu,Ethiopia,Female Winner,Tokyo 2012,http://en.wikipedia.org/wiki/Atsede_Habtamu,,Atsede Habtamu Besuye (born 26 October 1987) is an Ethiopianlong-distance runner who specialises in road running and the marathon distance.,1987,2012,25
Gebregziabher Gebremariam,Ethiopia,Male Winner,New York City 2010,http://en.wikipedia.org/wiki/Gebregziabher_Gebremariam,//upload.wikimedia.org/wikipedia/commons/thumb/3/36/Gebremariam_NYC_marathon.jpg/220px-Gebremariam_NYC_marathon.jpg,"Gebregziabher Gebremariam (born September 10, 1984 in Tigray) is an Ethiopianlong-distance runner. He established himself at the IAAF World Cross Country Championships, winning the junior title in 2002 and two silver medals in the senior races in 2004. He represented Ethiopia over 5000 metres at the 2004 Summer Olympics, taking fourth place. He was the 2009 World Champion in cross country.",1984,2010,26
Hailu Negussie,Ethiopia,Male Winner,Boston 2005,http://en.wikipedia.org/wiki/Hailu_Negussie,,"Hailu Negussie (born April 16, 1978) was the winner of the 109th Boston Marathon in 2005. He finished with a time of 2:11:45 and became the first Ethiopian to win the Boston Marathon since Abebe Mekonnen won the race in 1989. His personal best for the marathon is 2:08:16.",1978,2005,27
Firehiwot Dado,Ethiopia,Female Winner,New York City 2011,http://en.wikipedia.org/wiki/Firehiwot_Dado,//upload.wikimedia.org/wikipedia/commons/thumb/f/f1/Firehiwot_Dado.png/220px-Firehiwot_Dado.png,"Firehiwot Tufa Dado (born January 9, 1984 in Assela, Arsi) is a female long-distance runner from Ethiopia, who won the New York City Marathon in 2011 with a personal best time of 2:23:15 hours. She also took three consecutive victories in the Rome City Marathon.",1984,2011,27
Teyba Erkesso,Ethiopia,Female Winner,Boston 2010,http://en.wikipedia.org/wiki/Teyba_Erkesso,//upload.wikimedia.org/wikipedia/commons/thumb/b/b2/Erkesso.jpg/200px-Erkesso.jpg,Teyba Erkesso Wako (born 30 October 1982 in Arsi) is an Ethiopian runner who specializes in road running (including the half marathon and marathon) as well as cross-country running.,1982,2010,28
Derartu Tulu,Ethiopia,Female Winner,"London 2001, New York City 2009",http://en.wikipedia.org/wiki/Derartu_Tulu,,"Derartu Tulu (Amharic: ደራርቱ ቱሉ; Oromo: Daraartuu Tulluu; born March 21, 1972 in Bekoji, Arsi, Ethiopia) is an Ethiopianlong distance track, road and marathonathlete.",1972,2001,29
Deriba Merga,Ethiopia,Male Winner,Boston 2009,http://en.wikipedia.org/wiki/Deriba_Merga,//upload.wikimedia.org/wikipedia/commons/thumb/5/5b/Deriba_Merga.jpg/220px-Deriba_Merga.jpg,Deriba Merga Ejigu (Amharic: ደርባ መርጋ አጅጉ?; born 26 October 1980) is an Ethiopianlong-distance runner. He mainly competes in the marathon. He finished fourth in that event at the 2008 Beijing Olympics and went on to win the Boston Marathon the following year. His personal best for the distance is 2:06:38 hours.,1980,2009,29
Tirfi Tsegaye,Ethiopia,Female Winner,Tokyo 2014,http://en.wikipedia.org/wiki/Tirfi_Tsegaye,//upload.wikimedia.org/wikipedia/commons/thumb/0/07/Berlin_marathon_2012_am_kleistpark_between_kilometers_21_and_22_30.09.2012_10-15-40.jpg/220px-Berlin_marathon_2012_am_kleistpark_between_kilometers_21_and_22_30.09.2012_10-15-40.jpg,"Tirfi Tsegaye Beyene (born 25 November 1984) is an Ethiopianlong-distance runner who competes in marathon races. She has won the Paris Marathon (in a course record), the Tokyo Marathon (also in course-record time), and the Dubai Marathon. Her personal best of 2:21:19 hours came as runner-up at the Berlin Marathon.",1984,2014,30
Hailu Mekonnen,Ethiopia,Male Winner,Tokyo 2011,http://en.wikipedia.org/wiki/Hailu_Mekonnen,,"Hailu Mekonnen (born April 4, 1980 in Arsi) is an Ethiopianrunner, who specializes in the 5000 metres and cross-country running.",1980,2011,31
Gete Wami,Ethiopia,Female Winner,"Berlin 2006, Berlin 2007",http://en.wikipedia.org/wiki/Gete_Wami,//upload.wikimedia.org/wikipedia/commons/thumb/0/06/Paula_Radcliffe_NYC_Marathon_2008.jpg/175px-Paula_Radcliffe_NYC_Marathon_2008.jpg,"Getenesh (""Gete"") Wami Degife (Ge'ez:ጌጤነሽ 'ጌጤ' ዋሚ ደግፌ born December 11, 1974 in Debre Berhan) is an Ethiopian former long-distance runner who competed in cross country, track, and road events.",1974,2006,32
Berhane Adere,Ethiopia,Female Winner,"Chicago 2007, Chicago 2006",http://en.wikipedia.org/wiki/Berhane_Adere,//upload.wikimedia.org/wikipedia/commons/thumb/f/ff/Adereberhane_cropped.jpg/130px-Adereberhane_cropped.jpg,"Berhane Adere Debala (Ge'ez: ብርሀኔ አደሬ born July 21, 1973 in Shewa) is an Ethiopianlong-distance runner who specialises in the 10,000 metres and the half marathon. She was world champion over 10,000 m in 2003 and world champion in the half marathon in 2002. Adere works for UNICEF as a goodwill ambassador for girls' education.",1973,2006,33
Haile Gebrselassie,Ethiopia,Male Winner,"Berlin 2009, Berlin 2006, Berlin 2007, Berlin 2008",http://en.wikipedia.org/wiki/Haile_Gebrselassie,//upload.wikimedia.org/wikipedia/commons/thumb/f/f5/Olympic_great_Haile_Gebrselassie_speaking_at_the_Olympic_hunger_summit_in_Downing_Street%2C_12_August_2012.jpg/220px-Olympic_great_Haile_Gebrselassie_speaking_at_the_Olympic_hunger_summit_in_Downing_Street%2C_12_August_2012.jpg,"Haile Gebrselassie (Amharic: ኃይሌ ገብረ ሥላሴ?, haylē gebre silassē; born 18 April 1973) is an Ethiopianlong-distancetrack and road running athlete. He won two Olympic gold medals over 10,000 metres and four World Championship titles in the event. He won the Berlin Marathon four times consecutively and also had three straight wins at the Dubai Marathon. Further to this, he won four world titles indoors and was the 2001 World Half Marathon Champion.",1973,2006,33
Olavi Suomalainen,Finland,Male Winner,Boston 1972,http://en.wikipedia.org/wiki/Olavi_Suomalainen,,"Heikki Olavi Suomalainen (born March 27, 1947 in Sääminki, Finland) is a former Finnishmarathon runner. He won Boston Marathon in 1972 by 18 seconds margin to Víctor Mora. In 1973 he finished third at the same race.",1947,1972,25
Veikko Karvonen,Finland,Male Winner,Boston 1954,http://en.wikipedia.org/wiki/Veikko_Karvonen,//upload.wikimedia.org/wikipedia/commons/thumb/c/ce/Veikko_Karvonen_1.jpg/220px-Veikko_Karvonen_1.jpg,Veikko Leo Karvonen (5 January 1926 – 1 August 2007) was a Finnish athlete who mainly competed in the marathon. He won the bronze medal in the marathon at the 1956 Summer Olympics. At the 1954 European Championships he won the gold medal in the marathon and the following year won the Boston Marathon.,1926,1954,28
Eino Oksanen,Finland,Male Winner,"Boston 1959, Boston 1961, Boston 1962",http://en.wikipedia.org/wiki/Eino_Oksanen,,"Eino Oksanen (born 7 May 1931) was a Finnish marathon runner who won the Boston Marathon three times (1959, 1961 and 1962). Oksanen also won the 1957 Turku Marathon in Finland and the 1959 Athens Peace Marathon.",1931,1959,28
Päivi Tikkanen,Finland,Female Winner,Berlin 1989,http://en.wikipedia.org/wiki/P%C3%A4ivi_Tikkanen,,"Päivi Marja Sinikka Tikkanen (née Kunttu; born 19 January 1960 in Savitaipale) is a retired female long-distance runner from Finland, who won the 1989 edition of the Berlin Marathon. A two-time Olympian (1988 and 1992) she ended up in fourth place in the women's 3,000 metres at the 1991 World Championships. Tikkanen was Finnish champion in the same event for ten years in a row (1985–1994). She was coached by her husband Esa Tikkanen.",1960,1989,29
Paavo Kotila,Finland,Male Winner,Boston 1960,http://en.wikipedia.org/wiki/Paavo_Kotila,,"Paavo Edvard Kotila (August 26, 1927 in Veteli–January 26, 2014) was a Finnishlong-distance runner, Olympian, and three-time national champion in the marathon (1955, 1956, 1961).",1927,1960,33
Ritva Lemettinen,Finland,Female Winner,"Chicago 1995, Chicago 1993",http://en.wikipedia.org/wiki/Ritva_Lemettinen,,"Ritva Kaija Hannele Lemettinen (born September 9, 1960 in Ylistaro) is a retired female marathon runner from Finland. She represented her native country at the 1992 Summer Olympics in Barcelona, Spain, finishing in 14th place in the women's marathon. She is a two-time winner of the Chicago Marathon, having topped the podium in 1993 and 1995.",1960,1993,33
Antti Viskari,Finland,Male Winner,Boston 1956,,,,,,
Paul de Bruyn,Germany,Male Winner,Boston 1932,http://en.wikipedia.org/wiki/Paul_de_Bruyn,,"Paul de Bruyn (October 7, 1907 — April 5, 1997) was a German athlete.",1907,1932,25
